ID,行政區,地址,店名,店家說明
37727a00-dc5e-448c-84bf-11cc82885695,中正區,臺北市中正區文盛里羅斯福路三段２４４巷１０弄１７號１樓,庭園二手文教有限公司,新影音館在2014年臘月遷移至現址， 同時轉型為二手影音產品(CD、DVD、黑膠唱片)專門店， 提供物超所值及多樣化的的影音商品讓顧客盡情選購， 地下一樓更規畫成多功能演藝廳，提供各類型講座及Live演唱。
37ee53e5-ebde-462a-9d16-76fddfae3550,中正區,臺北市中正區市民大道三段2號,三創生活園區_DELL,
37f97dab-f391-4174-9890-9296b00a572e,中正區,臺北市中正區八德路一段1號,華山文創園區-有空藝點有空(C-1),華山文創園區-有空藝點有空(C-1)
3897b1e2-6a3b-4c0b-a885-6802a91fb53f,中正區,臺北市中正區北平西路3號2樓、1樓及地下1樓,微風場站店-咖哩咖哩,
3904c212-b7c5-4fb0-bbf6-832ee8bc5cf4,中正區,臺北市中正區梅花里市民大道３段８號４樓４０３，４０４室,吉畝電腦科技有限公司,電腦周邊零售，持台北熊好券消費即贈小禮物喔！數量有限！
391001af-68ff-4f06-8498-4ad8df2cd91d,中正區,臺北市中正區北平西路3號2樓、1樓及地下1樓,微風台北車站-傳遞幸福,
3913f749-cf6c-4386-a2ea-d525b5f3f3e7,中正區,臺北市中正區忠孝西路一段50號1樓,路易莎-新光保險小舖,平價精品咖啡連鎖品牌LOUISA COFFEE，秉持分享一杯好咖啡的職人精神，提供多樣精品咖啡、義式咖啡、世界茶飲、招牌輕食，從早到晚都有咖啡香和無油煙餐食陪伴您！
39d3322e-bcd8-4e54-9431-89fdf4971ac4,中正區,臺北市中正區光復里武昌街１段２２巷３１號,富雅美皮鞋店,少淑女鞋、運動鞋、休閒鞋、氣墊鞋、女鞋專賣店
39d7e30f-153c-456d-81c5-bd11e6018336,中正區,臺北市中正區寶慶路32號B1,遠百台北寶慶店-小南門,
3a042942-403e-4ed1-ac84-39c3453c92b0,中正區,臺北市中正區梅花里八德路１段８２巷１２號,春芳號-忠孝新生店,融合華麗現代感與懷舊復古風格，打造時尚復古情懷，創新手搖杯飲料專賣店
3a203743-6cca-4d9f-a0e5-7493da0d5cb9,中正區,臺北市中正區光復里延平南路６２號１樓,翔韻電器有限公司,翔韻音響多年來致力於家用及商用影音視聽設計規劃，主要以販售視聽家電、投影布幕、錄影監控、會議廣播、家庭劇院…...等智慧影音整合為主。經營四十年來，從商用空間的監控廣播擴音到家用家庭劇院規劃累積相當多的專業經驗，更在近年導入ＲＴＩ智慧居家控制的影音娛樂方案，翔韻在商需求、新居裝潢規劃中也搭配非常多優秀的設計師為不同的影音聽需求、及設計裝潢與居家生活作全方位的整合，為配置出最符合業主的需求全力以赴。
3a56640d-bfd7-40f0-aa21-41328f4b4d2f,中正區,臺北市中正區忠孝西路一段36號1F-01,HOYII北車站添好運(1F-01),港式點心
3ac647d2-bc1c-4ca9-bbb9-21ac3bd8b256,中正區,臺北市中正區北平西路3號2樓、1樓及地下1樓,微風台北車站-犁茶品記,
3b12c127-aa75-485a-bcc3-5c0cf7773ce3,中正區,臺北市中正區梅花里市民大道３段８號４樓４１０室，４１１室,標緻喇叭音響行,不只滿足了所有顧客在聽覺上的最高標準，更帶給顧客在視覺上全新視野與感受. 我們除了原有劇院音響的選擇外，目前也提供專業錄音、視訊直播、PA廣播工程、家庭歡唱及教學擴音的品項。現場有專業人員可提供諮詢及規劃，且門市展售多種音響品牌，讓您不必在各店家間遊走及詢價，讓我們可以給您最合適的服務與搭配。
3b8eae9f-03c9-4254-82c4-d1b4f3effac5,中正區,臺北市中正區北平西路3號2樓、1樓及地下1樓,微風台北車站-裕嶺一,
3bea05c7-ed53-493b-b81a-dba8e57a3489,中正區,臺北市中正區寶慶路32號8F ,遠百台北寶慶店-銀谷,
3c2062bd-7aad-47f9-bd45-35283cea5dab,中正區,臺北市中正區寶慶路32號4F ,遠百台北寶慶店-MY DE GIRL                    ,
3c4752e7-45bc-47d5-8697-589b835806df,中正區,臺北市中正區黎明里忠孝西路１段５０－１號５號廣場,元慶研磨工坊,現場研磨黑芝麻粉，杏仁粉 百分之百無糖、無香精
3c5c60d0-c682-4cd3-91e6-6933af632719,中正區,臺北市中正區汀州路３段１８７號,台大光學隱形眼鏡有限公司,專業驗光、配鏡。來台大配新眼鏡，讓您視事入佳境
3c76eae9-5b15-48c2-811d-dcdf5f216ab0,中正區,臺北市中正區中山南路7號地下1樓,微風台大醫院商場店-安永鮮食,養生藥膳、鱸魚精、湯品、魚鬆，健康餐食
3ca5e737-6f9b-4a17-9d67-e1f5c9521512,中正區,臺北市中正區中華路２段４５９-１號,家家電器行,在台北市中正，萬華區開業已有30年，在地服務客人已跟朋友一樣。 家裡電器用品有任何問題都能找我們為你服務。
3cc8c886-51a2-453c-9d83-4df56d156977,中正區,臺北市中正區寶慶路32號4F ,遠百台北寶慶店-LePolka                       ,
3ceffe5e-192a-4bdb-a5b9-b8273341fa57,中正區,臺北市中正區北平西路3號2樓、1樓及地下1樓,微風台北車站-屈臣氏,
3cf34565-9e2b-4238-b862-0186db1a2ffc,中正區,臺北市中正區中山南路7號地下1樓,微風台大醫院商場店-台中霧峰農會,心愛霧峰、關懷大地台中霧峰農產品
3d740a9b-5e3d-41df-88b3-9f9f07be5c10,中正區,臺北市中正區黎明里懷寧街７６號１樓,超級小糬咖啡茶飲店,咖啡茶飲，杯杯現泡 “精選好豆， 高品質、安全、現點現沖”
3d83f7d9-54ee-44ec-9362-18dd093ccd83,中正區,臺北市中正區河堤里同安街１０７號,財團法人台灣文學發展基金會市定古蹟紀州庵及新館營運管理處,「紀州庵」初建於1917年，原為平松家族經營的日式料亭，2011年在臺北市政府文化局指導下，以「紀州庵文學森林」為名， 進行文學的展演與推廣； 已舉辦超過5000場展覽表演、講座、作家對談、書籍分享、藝文導覽等各式藝文活動；亦有經營森林書店及風格茶館。
3d8a81c8-1131-49a5-bce2-eeb2b0ba49f6,中正區,臺北市中正區寶慶路32號6F ,遠百台北寶慶店-東妮寢飾品                    ,
3db35a7f-47e8-4add-9492-53d1168d4d08,中正區,臺北市中正區忠孝西路一段38號凱撤飯店B1F,太陽蕃茄拉麵－站前店,太陽蕃茄拉麵源自於日本「大阪王將」企業體系中的拉麵業態，「大阪王將」在日本當地及海外已擁有300餐廳以上的EAT&株式會社。品牌誕生的概念是「能保存美味及兼顧身體健康的日式拉麵」，第一家店誕生於2006年在日本東京的錦系町，以東京23區為中心開出17家店，而海外於2012年10月在台灣台北凱撒飯店B1美食廣場開出第一家，目前陸續籌畫展店中。太陽蕃茄拉麵以創新拉麵概念'「美味、美容、健康」，其創新獨
3e77ec14-2da5-40a4-9289-179db6fce357,中正區,臺北市中正區八德路一段1號,華山文創園區-小農討酒(貨櫃3),華山文創園區-小農討酒(貨櫃3)
3e8462ca-52b0-42f1-ab2f-fa1257dcc27d,中正區,臺北市中正區市民大道三段2號,三創生活園區_CASIO專賣店,
3e9b16c6-ca1b-4d36-8e96-bb5a92ca81ff,中正區,臺北市中正區市民大道１段１００號地下街９８號店鋪,玉耀坊,水晶、玉石、原礦晶洞零售
3eb57dca-d5a9-4465-a78b-926cca6fe542,中正區,臺北市中正區水源里水源市場１樓８號,水源市場一樓第８攤位,水源市場內溫馨可愛的店面～好吃的丼飯喔！
3ef53dd4-fce9-4057-b1f3-33e70c3704d4,中正區,臺北市中正區市民大道三段2號,三創生活園區_Tokuyo,
3f1beed9-7a52-4ed6-ace2-116d10a7de66,中正區,臺北市中正區中華路２段３１１巷38,南機場好吃炸Ｇ,高cp值銅板美食
3f80d383-b60a-42f0-b90f-47c80bd170a9,中正區,臺北市中正區忠孝西路１段６６號,新光三越台北站前店-好煮藝,
3fa72418-fb15-4dc0-a271-e842653ebffd,中正區,臺北市中正區信義路二段283號,橋登企業股份有限公司,GORE-TEX防水防風外套
3fac32d6-0daa-4207-a678-03b38af8b57a,中正區,臺北市中正區北平西路3號2樓、1樓及地下1樓,微風台北車站-布里王子 2F,
404ebd00-8d30-44d2-91ed-2094a4beec61,中正區,臺北市中正區寶慶路32號B1,遠百台北寶慶店-宏昌,
40acc2f6-d8ed-4d28-af8d-9d2af7f61b8e,中正區,臺北市中正區武昌街一段22巷20號,噗璞手作工作室,台灣手工拼布包，專營：台灣布料，特色日本，美國手工拼布包， line ID:0953520601
40bc0f98-7491-47d6-8dce-9de66e81fd76,中正區,臺北市中正區忠孝東路一段12號B1樓,台北喜來登大飯店-辰園,辰園五度蟬聯《米其林餐盤推薦餐廳》榮耀，特聘港籍廚師團隊完美呈現粵式經典名菜，在簡約現代中國風氛圍中，品嚐傳統與創意下的道地粵菜與港式飲茶。
40c2304b-6754-420e-b1fe-8ff5b16e51b0,中正區,臺北市中正區建國里衡陽路１３０號１樓,天晴一九八二股份有限公司,台灣100%原葉好茶 自栽茶園於南投凍頂鳳凰山，傳承五代百年製茶歷史。一口好茶，一杯台灣味。 優惠加碼：使用熊好券消費任一品項，+10元即享鹿谷烏龍綠茶大杯一杯。
40f55791-531e-4b27-941d-1d469b14d25a,中正區,臺北市中正區忠孝西路１段６６號,新光三越台北站前店-豆腐村,
418791a6-5ff7-4761-8cb5-6c6fafbd3291,中正區,臺北市中正區中山南路7號地下1樓,微風台大醫院商場店-彼得好咖啡,平價複合式烘焙咖啡，三明治專門店
41928900-08cb-4226-a7a8-c2b9f06c93f4,中正區,臺北市中正區寧波西街33號1樓,蓁秀有限公司,起家雞中正寧波店
41aa0221-38e8-42ef-930d-78d6501be6de,中正區,臺北市中正區寶慶路32號4F ,遠百台北寶慶店-銀穗                          ,
41b21157-03e0-480c-b3da-977a0b94cc91,中正區,臺北市中正區梅花里八德路１段８２巷９弄７號,I'm PASTA 光華店,本店之醬料均選用新鮮食材自行熬煮，製作過程繁瑣、成本昂貴、現點現做，用心提供新鮮健康的美味料理。
41bb279b-df3b-4038-87b3-9b392c5f32c7,中正區,臺北市中正區寶慶路32號1F ,遠百台北寶慶店-Whoo                          ,
41fc0c53-aed5-4a20-a152-ab4cf45c7e41,中正區,臺北市中正區寶慶路32號4F ,遠百台北寶慶店-麥雪爾                        ,
42486f5f-c070-464c-925a-615d10b21222,中正區,臺北市中正區文盛里羅斯福路３段２７４―１號,標準光學隱形眼鏡行,在地經營超過40年，服務用心，讓顧客賓至如歸。 注重專業跟品質，每個成員均領有專業技術證書，碩士級的驗光師用心幫每個客人做詳細的檢查，力求每副眼鏡都能清楚又舒服。
4268a3d3-c2c1-4630-bceb-29094a4910b2,中正區,臺北市中正區寶慶路32號2F,遠百台北寶慶店-KAWAKUBO,
42756dbc-0011-46f4-b8df-1f62c2da3984,中正區,臺北市中正區黎明里市民大道１段１００號台北地下街５７室,百花屋,日本進口玩具精品，日台同人周邊商品，種類多樣豐富！
42a09323-6aae-4b35-99ed-80f6d3c96560,中正區,臺北市中正區市民大道三段2號,三創生活園區_Logitech G ,
42bed9f5-9dfd-4885-a836-bb43cb74602b,中正區,臺北市中正區南福里福州街１１-５號１樓１１－７號１樓,安琪兒婦嬰百貨,提供優質產品給孕媽咪及新生兒
42bf68fd-b48a-43fb-857e-f3ede7554d2a,中正區,臺北市中正區市民大道三段8號4樓47室,嘉興國際股份有限公司光華營業所,公司位於光華數位新天地四樓47.48室，本公司有別其他門市，主要以銷售專業技術及服務客戶滿意為導向之公司，銷售:網路儲存、磁碟陣列、富士通NB、錄音筆、數位影音播放 3D滑鼠之類
4340c0be-8c41-4266-aa08-de8ba67b883f,中正區,臺北市中正區市民大道三段2號,三創生活園區_COCO壹番屋,
436fa56f-09eb-4d33-87a8-045dcc8bfe82,中正區,臺北市中正區市民大道１段１００號１４３室,WALLABY袋鼠牌,袋包箱專賣店。
43b5adae-e910-4e9b-a246-be061f5d80f1,中正區,臺北市中正區武昌街一段16巷2號,植蘊武昌概念店,喝的輕食，為生活注入自然的養分 讓植蘊成為一種習慣。
4441ee97-d08b-4c79-bab9-cec922ac3c4e,中正區,臺北市中正區南福里南昌路２段３４號,慶和傢俱行,專營各種實木家具，包括柚木，樟木，檜木等等……
44c8151b-1ee3-494b-be5f-cd5851f967b9,中正區,臺北市中正區市民大道三段2號,三創生活園區_OGAWA,
451de6d3-d5b1-4862-a926-2505fd9325dc,中正區,臺北市中正區衡陽路39號1樓,零知茶衡陽示範店,零知的特色商品使用具備認證、產銷履歷等來源的「靈芝」和「有機白木耳」；經過特殊工法製成人體易吸收的粉狀，再搭配產銷履歷來源手工熬煮的有機白木耳，喝飲品的當下，間接的吸收大量的多醣體和三萜類達到三防（防老、防呆、防病）還有素食燕窩富含豐富的膳食纖維、多種胺基酸、礦物質，達到二顧（顧腸胃、顧體態），這樣的機能性飲品是趨勢，以這樣的產品調製口感豐富、多樣化的飲品更是「零知」邁入市場的堅持～
45ea6d13-e24a-4ab8-9cce-e410a4b86c4b,中正區,臺北市中正區寶慶路32號3F ,遠百台北寶慶店-IN LOOK                       ,
45fd5bb2-6349-4782-bdeb-4a238d250a06,中正區,臺北市中正區黎明里忠孝西路１段４９號,康是美站前門市,康是美藥妝店
46094ac3-4271-4e3b-bebc-38af2eaf1b7d,中正區,臺北市中正區南門里延平南路１５７巷５號１樓,公克商行,門面是面對廣州街8巷。公克是咖啡跟烘培時的基本測量單位，公克的英文，gram，也是祖母的暱稱。因為店面是利用阿嬤家的一個空間所以就把店取名為gram coffee，希望提供好喝的咖啡跟好吃的糕點給大家。來店有美式咖啡9折優惠。
46abd84c-6bc9-4e60-9d43-25ef9a923b44,中正區,臺北市中正區寶慶路32號7F,遠百台北寶慶店-PB西服,
46d7c1af-f849-4ceb-9407-edfe2299ddd7,中正區,臺北市中正區南昌路２段４３號,南亞家具行,老字號～ 提供各式風格家具、精品名床，亦可客製化訂做精品沙發，櫥櫃… 滿足不同的需求。
46f9f11e-a3fa-45be-9372-0920a4fffa74,中正區,臺北市中正區信陽街14號,Burger talks 淘客漢堡 北車店,"“會說話的淘客漢堡，讓漢堡告訴您好不好吃” 堅持現點現做、搭配手工熬製醬料，完美呈現美國東西岸特色 """
47056331-ebec-4d6f-a1a0-acf95aff89fc,中正區,臺北市中正區梅花里新生南路１段６號Ｂ２－４,東京包膜工作室,3C產品如同人，需要細心保養才能維持零瑕疵外殼，別再將它藏在保護殼、保護套中，誰能料到何時會在柏油路上側面跌落、正面大滑壘，要做保護絕對不能做一半，要將它全身包得滴水不漏，【東京包膜(台北總店)】推出多種超值優惠專案，所有細節通通搞定！清潔灰塵、油垢及指紋，並且阻隔日光照射延長螢幕壽命，整套保養後包準外型絕不受損、更加晶亮！
47261057-8962-4ef9-bf69-1e677263e40d,中正區,臺北市中正區南陽街20-3號,滷味先生,加熱滷味
472739ec-c686-4184-a4a9-78d3f7ecbf1b,中正區,臺北市中正區北平西路3號2樓、1樓及地下1樓,微風台北車站-王師父,
472d23c5-5e5d-4700-a166-68c31d14a2a3,中正區,臺北市中正區桃源街1號3樓,賽凡娛樂股份有限公司,錄音設備器材零售：監聽耳機、音響、麥克風、吉他、錄音介面等。
47eb32ac-8924-422d-920b-ea7ef9defadc,中正區,臺北市中正區漢口街１段３號B1,佳佳唱片行（漢口店）,我們是位於台北車站的佳佳唱片行，有許多台版、進口實體商品 歡迎大家來尋寶。
47ef4f96-4481-48b3-9bcd-3c3026cc15e4,中正區,臺北市中正區黎明里南陽街１５-５號,迷客夏台北南陽店,迷客夏台北南陽店位於台北車站補習街，提供優質飲品，歡迎蒞臨。
480f15bb-fb7a-4a86-97db-c3f326900c3e,中正區,臺北市中正區漢口街一段3號5樓,讀享國考小學堂,讀享之成立宗旨是建立一個提供考生準備考試正確方向並幫助其快速考取的教學平台，超完美補教名師與熱血上榜者們的結合構成了讀享的黃金作者/講師陣容，嚴謹對待每一份稿件的法律編輯群成就了書的品質保證，把考試用書當成藝術作品在排版的美術編輯讓讀享的書好看又好用，貼心活潑又超專業的課程營業部為每一位學員提供專屬、貼心、有效率的課程服務。
4811cf5e-55e2-4643-a9cb-329e1950f9d4,中正區,臺北市中正區北平西路3號2樓、1樓及地下1樓,微風場站店-乾杯燒肉,
483ea2d8-0b53-4b39-ad0c-c24bb04a9d02,中正區,臺北市中正區幸市里忠孝東路２段１３４巷６號,鬍鬚張股份有限公司忠孝新生分公司,「鬍鬚張魯肉飯」品牌建立要追溯到民國四十九年，民生西路雙連市場對面的一個賣魯肉飯攤子開始。由於味道好、口味佳、真材實料，好口碑帶來極佳的生意。鬍鬚張創始人張炎泉先生，長期忙碌挪不出時間來整理他那和生意同樣茂盛的鬍子，久而久之，親近的老顧客就膩稱他為「鬍鬚張」，因此「鬍鬚張」之名從此就不脛而走，於是魯肉飯和鬍鬚張成了不可分割的註冊商標
4865447a-f71d-4006-84af-72b051db7cd4,中正區,臺北市中正區北平西路3號2樓、1樓及地下1樓,微風台北車站-津吉栗,
486713fa-2f4d-4782-b558-f98c3aec1cc0,中正區,臺北市中正區龍福里南昌路１段２８號,桐花小吃,便當店，提供內用外帶
49a018a6-1777-4bf0-90d8-0282ba47b562,中正區,臺北市中正區中山南路7號地下1樓,微風台大醫院商場店-德風健康館,德國專業保健食品
4a060445-2a53-4347-8ec9-ded5813b4f36,中正區,臺北市中正區市民大道１段１００號Ｂ１服飾４區１６７號,傘傘動人店,販售各式晴雨傘，正版授權姓名貼紙及印章
4a0da8c0-4929-4509-94ac-ec86b34d3e83,中正區,臺北市中正區南福里南昌路１段１１６號１樓,阿東嚴選水果行,"平價水果切盤 新鮮好吃 適合家庭 公司開會 員工聚餐 高級精緻水果禮盒、是送禮最佳選擇,櫻桃,水蜜桃,葡萄,精美包裝,品質保證。"
4a7ac93a-5f43-4472-b40b-e93676b36a84,中正區,臺北市中正區南福里福州街２號１樓,媽媽餵股份有限公司婦幼門市,Mamaway 媽媽餵門市是一家追求卓越的公司，我們除了研發、販售有道理的商品，也全力支持母乳哺育，因此我們門市人員都具備母乳咨詢師的功能。 誠心地和每位進來的客人分享經驗，讓新手媽媽們對孕期及哺乳期有更貼身的暸解！
4aba70cf-2ddc-465f-8d45-28e95a68002c,中正區,臺北市中正區忠勤里中華路２段３０９巷７號,嚼對牛牛排館,南機場夜市牛排館
4b11c9d9-d6fa-4bb2-82d6-83e6489a9a97,中正區,臺北市中正區新營里愛國東路２０之１號1樓,佳暘眼鏡,Nikon視光體驗中心專業服務，憑券配鏡小錢變大錢，500折抵1000
4b30d311-4888-4193-80d2-5246893fe406,中正區,臺北市中正區幸福里杭州南路１段１０號,清心福全青島東店(壹茶飲料店),來清心～喝好茶～
4b92dfa8-fcd0-4c1f-85c9-a8fc59c7e92f,中正區,臺北市中正區文盛里羅斯福路３段２８４巷１０號１樓,池先生茶餐廳有限公司,從一台餐車開始，池先生以大馬家常菜回味老家及遙遠的童年回憶，不論是瓦煲雞飯蓋子掀開的吱吱聲響、叻沙Laksa麵中夾帶著咖哩飄香和濃郁椰漿，又或者芭蕉葉盛著椰漿飯，再淋上靈魂主角：參巴醬sambal。食物永遠是最溫暖的故鄉，是異鄉遊子心裏的嚮往，在池先生的kopitiam遇見馬來風味飄香。
4bd4bf01-5a05-4469-bbca-55845dbebcc5,中正區,臺北市中正區水源里汀州路３段１７８號１樓,瑪克商行,來到台大公館商圈，摩瑪克6間門市是您最佳購物的選擇。 提供各式運動休閒品牌鞋款、服飾、配件，秉持站在消費者的立場為您提供最合宜舒適的裝備。 各門市皆為國民旅遊卡特約商店，歡迎使用國民旅遊卡消費，也提供LINE PAY、街口 、TAIWAN PAY等更便捷的行動支付工具 以滿足您更快速、更貼切的購物體驗，我們隨時歡迎您的蒞臨!!
4c873b6a-ce8d-43e2-84cf-f1a56fa7dd48,中正區,臺北市中正區市民大道3段8號2樓57室,普雷伊光華門市,【普雷伊電視遊樂器專賣店】全台最大、最專業的電視遊樂器專賣店，提供您在購物時以最實在的價格、最舒適的購物環境、最便利的方式來享受電玩購物服務。
4c8b5f8a-34a7-4124-a92c-695ab9dcae06,中正區,臺北市中正區北平西路3號2樓、1樓及地下1樓,微風台北車站-和民手作廚房,餐飲
4ccecbc2-d48c-4d18-a03a-1876fe76bdb1,中正區,臺北市中正區羅斯福路三段18號,米澤製麵(台北古亭店)-讚岐烏龍麵專門店,米澤製麵 - 讚岐烏龍麵專賣店，秉持日式大眾美食的宗旨，來推廣日本讚岐烏龍麵，其使用進口小麥粉、自家生產的烏龍麵，搭配現場熬煮的鮮美昆布高湯，煮出滑順Q彈的烏龍麵，還有酥脆的天婦羅，鮮嫩可口、挑動您的味蕾。
4d0c97f8-dd54-44b6-875a-9c18a7bd4ee0,中正區,臺北市中正區水源里汀州路３段１２８號１樓及Ｂ１,摩曼頓企業股份有限公司汀州第二門市,Converse專賣店
4dc8c6f9-4b2c-4d03-9da7-b3307617147f,中正區,臺北市中正區水源里羅斯福路４段９２號１樓之４１室,水源市場茂村水果行,茂村水果行
4e0d8a17-5e36-44dd-bb47-57041b1b4f50,中正區,臺北市中正區市民大道三段2號,三創生活園區_DJI,
4e1b2703-0cff-41e5-94bc-e3b69746cd9d,中正區,臺北市中正區南昌路２段２１號,億華家具有限公司,億華家具有限公司以專業者的立場為您找尋好的材料，替您挑選好的師傅，加上合理的管銷費用，讓我們永續經營，確保品管。 更以嫁女兒的心態，來維護我們所製做的每一件產品，讓您稱心滿意，完善的售後服務，更是我們所追求的目標。 當然，您的光臨將會是我們最誠摯的期待。
4e561710-7027-43b6-9b02-f00aed8a342a,中正區,臺北市中正區黎明里市民大道１段１００號地下一層Ｓ１０５－１店舖,聚寶成實業股份有限公司之傑森通訊,通訊配件
4e6e3a37-fb4b-4065-80ec-2addc2e553ad,中正區,臺北市中正區市民大道三段2號,三創生活園區_振光 ASIA GOAL,
4e7754a4-a38c-4064-acba-d195c1c2c760,中正區,臺北市中正區寶慶路32號2F ,遠百台北寶慶店-G.D.C                         ,
4e8ccb80-330c-4eea-ad20-4c4a231802a7,中正區,臺北市中正區螢圃里汀州路２段９６號１樓,蜀來飽川味麵店,道地的川味小吃，離台北捷運古亭站不到10分鐘，核心獨門花椒醬是使用四川二筋條辣椒、滿天星辣椒、茂縣大紅袍花椒，鵑城牌郫縣豆瓣醬等四種以上的辣椒與八種天然香料精心煉製的辣油，佐以大骨、雞骨、新鮮蔬菜熬煮出的高湯，用心製作出的重慶小麵、道地酸辣粉、紅油抄手、口水雞等美食！ 店內風格以乾淨、舒適像在朋友家接受款待的感覺，推薦您前來一試！
4edea671-23db-4f79-8766-75a9565e0a9e,中正區,臺北市中正區廈門街34巷2號,Overthink 餐飲小吃部,義大利麵、燉飯、炸物與飲品的餐飲小吃部，偶爾還會有隱藏菜單。 - *本店座位數有限，建議來吃飯前可以先訂位唷！ *禁止外食 *內用低消$250/人，10歲以下兒童免低消
4f9724ea-ebde-4e58-aa7b-200f27bfa038,中正區,臺北市中正區市民大道三段2號,三創生活園區_仙德曼SADOMAIN,
4fe8470d-4bfe-40fa-9338-13aff1c52acf,中正區,臺北市中正區金山南路一段108-1號,躍獅東門藥局,躍獅，台灣第一家藥師親自執業的連鎖藥局，我們提供眾多醫藥保健、照護、醫美人氣優惠商品。躍獅振興加碼5倍變10倍！現在憑5倍券享振興商品5折，消費滿500再送100元、滿1000送300元！
4ff6d528-a535-4ea2-9214-8956e2549923,中正區,臺北市中正區寶慶路32號5F ,遠百台北寶慶店-莎露                          ,
50762bf6-d8e4-407c-a27d-3d9c18892470,中正區,臺北市中正區忠孝西路一段38號B1-I區,銀座杏子豬排 台北凱撒店,「杏子日式豬排」是為幸福存在。 日本熟成豬肉的權威，追求最完美的熟成時機，達到肉質軟嫩香氣十足階段， 讓您感受最道地日本味，每一口都享受到色香味與視覺滿滿的感動。
50ffb39c-dd15-47b0-86f3-fd476c1f8a0b,中正區,臺北市中正區信陽街5號之2,路易莎-信陽直營門市,平價精品咖啡連鎖品牌LOUISA COFFEE，秉持分享一杯好咖啡的職人精神，提供多樣精品咖啡、義式咖啡、世界茶飲、招牌輕食，從早到晚都有咖啡香和無油煙餐食陪伴您！
51434908-2588-4dd4-88dc-acadfe73cd2d,中正區,臺北市中正區寶慶路32號8F ,遠百台北寶慶店-吉達興,
517b8bac-12f0-4a97-b318-e1e7cffc2dc7,中正區,臺北市中正區市民大道三段2號,三創生活園區_祥建家電,
51a5beb6-2609-4d99-a6ef-6c173b3bc3f3,中正區,臺北市中正區梅花里市民大道３段８號５樓５１８室,欣立電器行,"電器百貨，DVD,無線電話，有線電話，錄音筆"
