ID,行政區,地址,店名,店家說明
b3c3bfea-46c8-409a-bc10-00fb9a672d4a,中正區,臺北市中正區黎明里忠孝西路１段５０之１號台北市站前地下街１區２－１Ｂ,富博電玩超商,本店經營電玩及日系玩具、卡片、轉蛋、模型。
b3d3e56f-cf4d-4a8f-9b1e-782425feb382,中正區,臺北市中正區光復里武昌街１段６５號２樓,雪王食品行,成立於民國36年，以各式獨特口味冰淇淋聞名。除了真材實料的招牌紅豆或著芋頭口味之外，特殊口味的九層塔、肉鬆、豬腳、芥末，都可以滿足您的味蕾。
b3d46901-fa28-4302-868d-e1a683dff01e,中正區,臺北市中正區寶慶路32號7F ,遠百台北寶慶店-KIANDERSON                    ,
b3e68a2d-b49b-47df-9a21-b5325dad3a5b,中正區,臺北市中正區北平西路3號2樓、1樓及地下1樓,微風場站店-伯朗咖啡,
b3f5afc1-0b55-4792-a29c-2efeca5c2009,中正區,臺北市中正區寶慶路32號1F ,遠百台北寶慶店-迪奧                          ,
b40018a4-a9e7-4c3a-89dd-3ee7524df13a,中正區,臺北市中正區忠孝西路１段６６號,新光三越台北站前店-韓鶴亭,
b404d409-7d50-40d8-83aa-156ff7a5f79d,中正區,臺北市中正區汀州路３段８０號１樓,尚智水源,尚智運動世界經銷 Nike、Adidas、Puma、New Balance 等各大運動休閒品牌，商品類型包含專業運動與流行服飾、鞋款及背包配件。 可使用銀聯卡及支付寶消費，並歡迎使用國民旅遊卡消費。
b41773f7-ef7b-493b-9dcb-99dc8442d71a,中正區,臺北市中正區北平西路3號2樓、1樓及地下1樓,微風台北車站-郭榮市,餐飲
b44f937a-99fb-464f-adc9-d111331f3a42,中正區,臺北市中正區信陽街5-1號,泰泰徠了-台北站前店,來自泰國街邊正統茶飲文化 提供一種不同於傳統飲料店的味道
b47d0bb5-0aac-4e95-ba0f-bba8559a08f9,中正區,臺北市中正區市民大道三段2號,三創生活園區_Nikon,
b52e24d6-bac9-4f60-b69d-9a6eba8bb99d,中正區,臺北市中正區黎明里襄陽路２５號,石尚自然探索屋臺博店,憑台北熊好券 多項優惠等你拿~  門市多種優質商品 歡迎入內參觀選購！！
b534e390-146f-416b-a3e7-1ac67c054b11,中正區,臺北市中正區市民大道三段2號,三創生活園區_摩斯漢堡,
b57b24e5-3fe5-4594-b9da-0b69a27751ec,中正區,臺北市中正區許昌街30號2樓,瑪莎拉股份有限公司,魔法般的咖哩醬汁，慢火精燉36 小時洋蔥高湯，加入二十餘種天然辛香料黃金比例，而獨創一格的新歐風咖哩！ 使用熊好卷付款不限金額，結帳贈送百元貴賓卷乙張，下次使用(使用期限及規則如卷上說明)。
b59f8263-6eca-4e33-a6b6-b2b332fff5b7,中正區,臺北市中正區重慶南路１段７５號１樓,洋朵義式廚坊-重慶店,提供義大利麵、焗烤、燉飯、Pizza、輕食等平價美味的義式料理，讓人流連忘返的好滋味！
b5bf8fb5-06d5-46df-bfed-18ae847b441d,中正區,臺北市中正區寶慶路32號1F,遠百台北寶慶店-DARPHIN,
b5d922f9-b1af-40de-aae8-55e2faad4506,中正區,臺北市中正區北平西路3號2樓、1樓及地下1樓,微風場站店-星巴克,
b5e9bcb3-11e2-4cd8-a416-a3c670a39770,中正區,臺北市中正區新生南路一段6號B2-15,台灣中資國際有限公司,位於光華商圈的正版軟體專賣店: AutoCAD、微軟系列、CorelDRAW、Adobe系列產品專營.
b61a3321-d7ef-4441-aa7d-708a8fbb59e1,中正區,臺北市中正區北平西路3號2樓、1樓及地下1樓,微風台北車站-西螺麻糬大王-幸福翔綺麻糬,餐飲
b6596a0a-85db-480f-ad26-18020702b335,中正區,臺北市中正區水源市場２樓 第２０號攤位,新佳豐食品行 第20攤,記憶中的味道總是最美好的，公館在地經營超過40年，秉持「佳豐用心‧食在安心」的品牌精神，傳承用心純手工製作，讓記憶中美好的味道繼續傳遞幸福。
b6610394-095f-466f-a33f-78804695b1d5,中正區,臺北市中正區延平南路210號1樓,大樹藥局 中正聯合店,1.優質「綜合感冒藥、胃腸藥、外用藥膏、保健食品、醫療器材、護具、醫學美容、婦嬰用品、奶粉(亞培、美強生、雀巢能恩、桂格、惠氏S-26、啟賦、諾優能…等)尿布(幫寶適、滿意寶寶、妙而舒、好奇、噓噓樂、大王…等)、及成人奶粉、特殊疾病營養品，亞培安素、葡勝納」供應2.慢性病連續處方籤調劑、用藥諮詢服務3.成人/嬰幼兒保健營養食品諮詢服務4.醫學美容保養品諮詢服務
b66f6f3e-31af-4909-b6f6-4a6626ee5b60,中正區,臺北市中正區中山南路7號地下1樓,微風台大醫院商場店-老董牛肉麵,國際牛肉麵節人氣銷售冠軍
b67f2219-8f39-47b4-afcb-f0b22f831391,中正區,臺北市中正區站前地下街、捷運西門站,花田囍飾zy,2006創業花田囍飾至今，從多樣的流行飾品配件起來，轉而專注於手作髮飾領域，台灣的行流市場目前受到日、韓的深刻影響，「花田囍飾」希望透過雙手，以手工為出發點從髮飾領域中，再次找回「台灣」的元素與價格。  強調台灣手作商品不亞於其他國家，並且花田囍飾的手工香蕉夾/叉梳不分髮量，從3歲的小女孩到髮量極多的成人都能使用同一樣髮飾，顛覆消費者對於髮飾的認知，成功打造兼具功能、美觀、實用的設計，「花田囍飾」
b6a413ef-d491-4882-b4ad-64eb7f4b411a,中正區,臺北市中正區水源里羅斯福路４段136巷3號,黛黛茶公館秀泰店,◎使用熊好券購買飲料，全品項享九折優惠
b76fc582-3752-4d36-9726-ccf1dc2c76e1,中正區,臺北市中正區寶慶路32號1F,遠百台北寶慶店-SISLEY,
b8102682-3495-4510-85ee-353e782a9ded,中正區,臺北市中正區開封街１段７９號１樓,科翔儀器有限公司,各式醫療器材，血壓計，血糖機，體脂計，電熱毯等居家醫療
b81ff41c-bfe1-411e-8236-bbb3cd3637d7,中正區,臺北市中正區黎明里漢口街１段１５號２樓至８樓,旅樂序精品旅館二館,旅樂序二館…貼心為您顧及身心靈的釋放，提供舒適溫暖的休憩空間，輕鬆徒步即到交通站的便捷樞紐， 為每一段旅程帶來結實累累的成果與美麗的詩篇，展開旅樂無窮的序章。 旅樂序二館位於台北市靠近館前路的漢口街 ;地處於台北市中心每日達數十萬人次的台北車站前，新光三越百貨旁，購物、飲食、交通非常便利。 近鄰台鐵、高速鐵路、台北捷運、即將開通的機場捷運、客運、公車的交通樞紐位置。
b82488dd-b84c-465e-981a-17a7a5793473,中正區,臺北市中正區新營里林森南路１４２號２樓,定食8南門店,精選日式主餐，搭配茶碗蒸、味噌湯、日式漬物及甜點的套餐定食只要180元起，份量感十足卻不失日式料理精緻的一面。品嘗一份日式美味定食，就在定食8！
b8aa8a3b-cde1-4568-941d-8b1e6d03bd94,中正區,臺北市中正區廈門街94號3F,青羽構造設計工作室,專營工藝品及藝文場地租借
b8b5d759-9341-43e5-910f-ee4283c680c8,中正區,臺北市中正區水源市場１樓４５號,大吉利元寶水餃,榮獲2021年天下第一攤水餃評審大賞
b8d7c4cc-e61c-4077-b984-8f271c71d820,中正區,臺北市中正區市民大道三段2號,三創生活園區_牛大大,
b8db0f0c-8eb7-4de1-a244-373741bae0c4,中正區,臺北市中正區忠孝西路一段36號1F-03,HOYII北車站SOLOMAX(1F-03),眼鏡
b9179cc3-5df9-4a70-bccf-3019b3f0dac1,中正區,臺北市中正區黎明里武昌街１段１號,榮樺商行,天天吃美味，日日好安心，提供安心美味的低卡餐盒
b980bd7d-4fa0-424b-b016-083f227845b8,中正區,臺北市中正區寶慶路32號3F ,遠百台北寶慶店-U're                          ,
b9aed531-59b8-4ecd-9f82-df5e549e785e,中正區,臺北市中正區寶慶路32號2F ,遠百台北寶慶店-SWAROVSKI                     ,
b9c346b1-588a-4e71-84f2-0bad256a2e69,中正區,臺北市中正區寶慶路32號3F,遠百台北寶慶店-Pink,
b9c732d7-7a99-44e1-b5de-b14aa1c585cd,中正區,臺北市中正區北平西路3號2樓、1樓及地下1樓,微風場站店-一風堂,
b9ce890b-b225-4459-903f-0620a17a6840,中正區,臺北市中正區台北市中正區新生南路一段104號,屈臣氏新生店,360度全方位服務：美妝、護膚、日用、健康！
b9d1119d-b95f-4ed1-ae04-fbcb8c5d5f40,中正區,臺北市中正區中山南路7號地下1樓,微風台大醫院商場店-誠和拍照機,快速又便利的快照工具
ba03df3b-9732-4bbe-b5e3-7c7038fd9078,中正區,臺北市中正區市民大道三段2號,三創生活園區_THE GUNDAM BASE TAIWAN,
ba26a642-4c9f-4b27-bf4c-c20fa0f7dc30,中正區,臺北市中正區水源里羅斯福路４段６８號,晶澈/晶碩光學公館門市,隱形眼鏡販售
ba7d4bb0-1541-4101-bb70-b78e15b7f09c,中正區,臺北市中正區寶慶路32號3F ,遠百台北寶慶店-F.F.F.F.                      ,
baa17612-c4fb-4f88-8a9b-f394c0c3337b,中正區,臺北市中正區水源里汀州路３段２７９號１樓,維綸麵食館,維綸麵食館1家60年的老店，代代相傳純手工製作的麵店，豪門傳的秘方手法，讓人想念老一輩的手藝。羊肉搶鍋麵，老把手製餅手蔥油餅，抓餅，餡餅，炒餅，老師傅熱炒，羊肉火鍋。炒飯，，手工水餃。
badcd158-a57e-4832-8229-70724751d330,中正區,臺北市中正區中華路二段307巷,鈺師傅上海生煎包,30年傳承 超高檔品質 上海生煎包 榮獲 十大夜市美食  夜市打牙祭多次得獎 感謝各媒體推薦 更謝謝客人們的多年照顧 上海生煎包 每個15元  使用熊好券消費可兌換生煎包 7 個。 (原價 105 元)
badf0d33-6fba-49a1-9df3-d5f6d37560f7,中正區,臺北市中正區北平西路3號2樓、1樓及地下1樓,微風台北車站-果然滋味,
bb083eea-f41a-433a-a962-4401fe4a4f24,中正區,臺北市中正區汀州路三段112號,魔法雞排,雞排36 變！─ 魔法炸雞Magicken 炸雞的境界再升級 耐高溫220 度芥花油大鍋備起 3 種醃料、3 款麵衣、4 樣灑粉 3x3x4，變化多端的炸雞魔法方程式 歐香、香辣、麻辣入味多汁 酥脆多力滋，玉米調香多味多滋 厚脆拍手，咔啦咔啦超爽口 薄脆胖果，怕胖首選低吸油 胡椒、辣椒、梅粉、咖哩粉任君組合 36 變的美味雞排，還可以怎麼吃？歡迎+1！
bb83c534-cc82-42b5-9f2a-e9ee3d039897,中正區,臺北市中正區忠孝西路１段６６號,新光三越台北站前店-廣安階,
bc03354c-8a98-42cf-80af-c724234e62b3,中正區,臺北市中正區北平西路3號2樓、1樓及地下1樓,微風台北車站-春上布丁蛋糕,
bc1a5080-2a50-488c-a8cb-31663b330324,中正區,臺北市中正區文北里杭州南路１段６３號,費利榭有限公司,主廚擅長義法式料理，以義大利麵、燉飯、肉類與海鮮排餐為主、歐式小酒館的方式呈現。  餐廳位於杭州南路一段、濟南路附近（鄰近華山），餐廳氛圍舒適慵懶、適合家庭聚餐與約會，我們同時也是寵物友善餐廳，歡迎毛小孩來找我們玩～
bc20a7ef-a94c-4f09-8bc9-2f11874b8a61,中正區,臺北市中正區衡陽路62號1樓,天仁茗茶 衡陽店,天仁茗茶以「老行業、新經營」為願景，不斷加強產品研發與創新服務，透過感動服務傳遞品牌價值，賦予「茶」更多元與生活化的內涵。
bc85f178-06ab-4689-8824-a5fc3d6932b0,中正區,臺北市中正區中山南路7號地下1樓,微風台大醫院商場店-小南門,古法純手工製作的傳統豆花
bc959b3d-6690-4107-98d6-6e4440792613,中正區,臺北市中正區黎明里市民大道１段１００號地下街電子三區９３號,馨運企業有限公司地下街門市部一店,"台北地下街- 最佳電玩遊戲購物品牌, TV Game主機、遊戲、週邊專賣,PlayStation 5,Nintendo Switch, Xbox Series X, 擁有實體門市供玩家選購各類電視遊樂器商品"
bcd0d4c9-f8a6-4896-9f50-cc374a7420a7,中正區,臺北市中正區忠孝西路１段６６號,新光三越台北站前店-JINS,
bd10b03f-d964-4872-aa3e-2865f8ed8fbd,中正區,臺北市中正區寶慶路32號6F ,遠百台北寶慶店-TENDAYs                       ,
bd64845b-4258-4a1c-aff7-70166d10ecae,中正區,臺北市中正區黎明里中山南路８號Ｂ１,杏一台大兒醫商場-摩斯漢堡台大兒醫店,摩斯漢堡秉持東方「醫食同源」的概念，堅持開發對健康有益的餐點，採用有機米、紐西蘭自然牛肉、生產履歷蔬菜等高品質食材，現點現做，進到MOS的店舖，就能馬上感受到滿滿的活力和幸福的滋味!
bd9542e4-0c2d-4194-a852-e5fc099ada4b,中正區,臺北市中正區梅花里市民大道３段８號４樓４９２室,慎美電氣行,音響器材/多媒體喇叭
be1207e9-532b-4950-ab6c-8e9caf71ef9f,中正區,臺北市中正區寶慶路32號5F ,遠百台北寶慶店-Mcgregor                      ,
be5c6733-a4e1-46df-9062-9d0149f203c6,中正區,臺北市中正區市民大道三段2號,三創生活園區_賽先生科學工廠,
be9ce56f-dc16-4b37-8427-f4848a2f9b44,中正區,臺北市中正區梅花里市民大道３段８號3樓,Game休閒館光華門市,Game休閒館光華門市位於光華商場3樓、從接運忠孝新生站口步行僅需五分鐘，提供家用主機、遊戲、電競周邊及公仔模型等販售，是您購物的最佳選擇。同時也提供遊戲中古回收服務，歡迎把遊戲帶到店內估價販售
beb471fb-0749-4e79-be45-da0375697659,中正區,臺北市中正區寶慶路32號1F ,遠百台北寶慶店-香奈兒                        ,
bf2cc2cf-001b-437c-a9d4-4bcb854d9339,中正區,臺北市中正區杭州南路一段115號,時時珈琲,時々珈琲是鄰近捷運東門站的外帶咖啡店，提供美式咖啡、單品卡布奇諾、拿鐵咖啡、特調咖啡與輕食小點。並銷售自家焙煎的精品咖啡豆與濾掛咖啡，歡迎機關公司、營業用咖啡豆配合。 優惠加碼資訊：來店消費即贈送兩張限量貼紙。
bf2ce998-ee96-449c-9426-52f800519e42,中正區,臺北市中正區開封街１段１０號,良品牛肉麵館,1971年至今傳承50年的好味道，人氣半筋半肉牛肉麵，每日用新鮮牛大骨燉煮原汁原味，刀切麵條有嚼勁，搭配煮到軟嫩恰到好處的牛肉與牛筋，好味道總是令人回味無窮！
bf4abae8-915f-4e21-b723-abb0d8b4d072,中正區,臺北市中正區寶慶路32號8F ,遠百台北寶慶店-8F-集中收銀台,
bf560a57-fdf6-48af-953d-8b7b83f4b071,中正區,臺北市中正區八德路一段1號,華山文創園區-小確幸紅茶牛奶合作社,華山文創園區-小確幸紅茶牛奶合作社
bf90d323-501c-40cf-b48a-9f1b48fdfc5d,中正區,臺北市中正區北平西路3號2樓、1樓及地下1樓,微風場站店-雞三和,
bfdfbaf5-2c6e-4565-a7c3-d3e89f01b430,中正區,臺北市中正區水源里羅斯福路４段２４巷４號１樓,邑將皮飾店,『邑匠皮飾精品Elegant Junction』-國民旅遊卡特約商家  是在地深耕30多年有溫度的老店家，在日新月異的時代中，如何做出品牌的差異性是品牌的首要課題。以精湛、嚴謹的皮革工藝突顯該品牌更深層次的價值，並持續不斷的採用不同質地的高品質皮革，創建更新穎、生動和實用的皮件；注入更多一線潮流時尚品牌，舉凡Gucci、BURBERRY、Prada、YSL、Coach、Longchamp...等
bfef0d75-32f2-4c91-8498-ba5875f86788,中正區,臺北市中正區羅斯福路四段132號1樓,米澤製麵(台北公館店)-讚岐烏龍麵專門店,米澤製麵 - 讚岐烏龍麵專賣店，秉持日式大眾美食的宗旨，來推廣日本讚岐烏龍麵，其使用進口小麥粉、自家生產的烏龍麵，搭配現場熬煮的鮮美昆布高湯，煮出滑順Q彈的烏龍麵，還有酥脆的天婦羅，鮮嫩可口、挑動您的味蕾。
bff16c4f-a068-49fd-b3cc-0b8ce54ef9c1,中正區,臺北市中正區八德路一段82巷6號1樓,原價屋電腦股份有限公司八德二店,原價屋Coolpc提供筆電、桌上型組裝電腦、品牌主機、電腦零組件、螢幕與鍵鼠耳麥電競週邊等3C類商品，台北光華商圈6家門市，全台17家門市。歡迎光臨，電腦組裝，全台無雙！
c037cd10-d246-41df-8435-2cdbc0b76509,中正區,臺北市中正區市民大道１段１００號地下１樓１４６號店舖,佑昇皮件行凱羅,各式背包 淑女包 行李箱 款式多樣
c086295d-c5ed-480f-aef4-7cd2c4a936b5,中正區,臺北市中正區開封街一段66號5樓,james元氣手作,"james元氣手作歷經多年時間淬鍊,傳承日本師傅的職人精神,十五道的製程工序,精心研發天然、無添加的低GI、高纖、高鈣、養氣、潤肺養顏美容的功能性飲品,不斷追求卓越!其主要產品包括: 1	雪耳露 2	杏仁露 3	杏仁紫米露 4	芝麻癮(飲) 以上產品規格有: 800ml/300ml,微甜/無糖/甜菊糖 品牌精神:“要讓食物成為你的藥物,不要讓你的藥物成為你的食物-西方醫學之父-希波特拉提斯”! 使"
c1ae5acf-b709-403a-8fa5-96b2288c13b6,中正區,臺北市中正區重慶南路一段６１號,三民書局重南店(書展組),走過一甲子的三民書局，現已有重慶南路跟復興北路兩家門市，還有一個「書種齊全、服務迅速」的網路書店，繁體書、港版書、簡體書、原文書等一應俱全喔。 http://www.sanmin.com.tw/
c1b94deb-0b51-4bbb-b12d-fefe52c62425,中正區,臺北市中正區北平西路3號2樓、1樓及地下1樓,微風台北車站-翰林茶館,餐飲
c1c922cf-849f-41bc-ab7e-5fbb81361b29,中正區,臺北市中正區水源市場１樓５４號,公館米粉湯,公館米粉湯起源於現在公館商圈東南亞戲院巷內，隨著水源市場建立遷移而有了現在的店面，老闆娘親切熱情好客，店裡每一道菜都是精心製作，口味全是親切的台式料理。 乳白色濃濃湯頭經熬煮而濃郁清香，細滑的米粉吸滿湯汁，配一口軟嫩入味的油豆腐，金黃色的滷肉飯肉汁Q彈而不膩，除此之外還有各式各樣的切盤小菜，簡單卻是最容易令人回憶的一道家常傳統小吃。
c1ecb125-c77e-4d5d-a7da-c62b91294875,中正區,臺北市中正區幸福里忠孝東路一段１５０號,鬍鬚張股份有限公司台北華山分公司,鬍鬚張魯肉飯」品牌建立要追溯到民國四十九年，民生西路雙連市場對面的一個賣魯肉飯攤子開始。由於味道好、口味佳、真材實料，好口碑帶來極佳的生意。鬍鬚張創始人張炎泉先生，長期忙碌挪不出時間來整理他那和生意同樣茂盛的鬍子，久而久之，親近的老顧客就膩稱他為「鬍鬚張」，因此「鬍鬚張」之名從此就不脛而走，於是魯肉飯和鬍鬚張成了不可分割的註冊商標
c27b1b46-da80-4b16-b4e3-fd41ade8f7a3,中正區,臺北市中正區愛國東路76.78號,風華絕色婚禮事業有限公司,婚紗攝影
c2a7e203-840d-470e-afe8-3b62cf071fd6,中正區,臺北市中正區寶慶路32號1F ,遠百台北寶慶店-佳麗寶                        ,
c3058836-4dec-41de-882f-ded4b40378de,中正區,臺北市中正區寶慶路32號B1,遠百台北寶慶店-哈根達斯,
c30b5a0a-323e-4ce8-a612-1a24b58695ea,中正區,臺北市中正區博愛路九號五樓之一,鴻儒堂書局,各種日文書籍、教材專賣 鴻儒堂出版品85折！
c3319146-d234-40ac-a74d-a9d7dc6de1ae,中正區,臺北市中正區沅陵街７號,賓士鞋業有限公司,位於沅陵商圈皮鞋店，販售兒童、男皮鞋、女鞋，專櫃品質、優惠價格，多樣選擇讓您挑選試穿！
c334cb6b-9599-4123-8a73-33feca61d61f,中正區,臺北市中正區武昌街一段3號,天仁茗茶 武昌店,天仁茗茶以「老行業、新經營」為願景，不斷加強產品研發與創新服務，透過感動服務傳遞品牌價值，賦予「茶」更多元與生活化的內涵。
c34378b0-917f-4f73-829b-786f3acbdf8a,中正區,臺北市中正區汀州路3段172號1樓,摩瑪克有限公司-汀州分公司,來到台大公館商圈，摩瑪克6間門市是您最佳購物的選擇。 提供各式運動休閒品牌鞋款、服飾、配件，秉持站在消費者的立場為您提供最合宜舒適的裝備。 各門市皆為國民旅遊卡特約商店，歡迎使用國民旅遊卡消費，也提供LINE PAY、街口 、TAIWAN PAY等更便捷的行動支付工具 以滿足您更快速、更貼切的購物體驗，我們隨時歡迎您的蒞臨!!
c3ae787f-5f9f-47bf-97dc-bcd7b884d46f,中正區,臺北市中正區光復里博愛路３６號３樓,台北伊玲玖青旅,1是開始0是圓滿9是永續 三姐妹就在北車附近的「老城中」長大， 從家中空房間偶然出租，變身連鎖旅店，老房變身時尚旅店。
c3e0daed-10bb-4883-b86d-37a830a19cc2,中正區,臺北市中正區市民大道三段2號,三創生活園區_Acer                ,
c3ef624c-03b5-4ceb-9178-8f4cc70f8194,中正區,臺北市中正區重慶南路一段67號,和洋百貨,和洋百貨成立近三十年，專門經營日系精品商品，販售商品包含食品、寢具、皮包、廚衛浴用品、男女內衣褲等等，提供最新時尚流行產品。
c3f93db0-9609-405c-9338-f65686858f21,中正區,臺北市中正區寶慶路32號1F,遠百台北寶慶店-春上,
c4437cee-e8f5-4b88-a1c7-99b9c5191292,中正區,臺北市中正區中山南路20號B1,詩篇咖啡餐廳,「詩篇咖啡餐廳」位於國家圖書館內，知識及歷史匯集處，充滿書香與咖啡香是放鬆心靈最佳秘境，享受愜意氛圍及美食佳餚。       走進詩篇，映入眼簾純白小房屋，有著家的溫暖，幾乎佔據整面的手繪牆，為簡潔設計增添溫馨繽紛感。空間明亮整潔，坐在寬敞環境中，心靈格外平靜；餐點考量到國家圖書館讀者，主打平價精緻路線，追求創新及完美，堅持手作，不用調理包，皆選上等新鮮食材；若想體驗五星級佳餚，更可量身設計高檔。
c451bd18-fb9e-494c-a701-ca27e15d3780,中正區,臺北市中正區愛國里中華路２段５３號１樓,樂東菓子,夏威夷豆塔、堅果塔伴手禮 無調味綜合堅果 傳統酥餅｜果香奶油餅、土鳳梨酥 牛軋糖 芝麻核桃糕、南棗核桃糕 各式點心伴手禮
c470941d-43d9-4b50-85a8-9f2df48814d7,中正區,臺北市中正區北平西路3號2樓、1樓及地下1樓,微風場站店-杏子豬排,
c4bf2ff4-f39e-4263-bfd2-245e8e27ca79,中正區,臺北市中正區北平西路3號2樓、1樓及地下1樓,微風台北車站-米樂爆米花,
c4e97ca1-2234-4333-8af7-ddce5f1475bd,中正區,臺北市中正區黎明里忠孝西路１段５０之１號站前地下街２之１Ａ號，４之２號,衣品時尚國際有限公司站前店,快時尚流行服飾
c51f6f92-16f3-4733-8536-730cc4d70dc9,中正區,臺北市中正區愛國東路52號,麗舍時尚婚紗,"麗舍本著聆聽新人心聲與需求，尊重新人對結婚品味的期待… 用心打造出優雅。品味。 流行時尚的愛情空間,堅持給新人 最好的服務品質。  台灣婚紗-台北婚紗-麗舍時尚婚紗-提供婚紗服務: 婚紗照、婚紗攝影、、婚紗禮服、婚禮企劃、整體彩妝造型、新娘秘書、禮服租借、婚紗包套、主體婚紗、婚紗諮詢婚紗寫真、台灣婚紗攝影、韓式婚紗攝影、度假婚紗攝影行程"
c5270237-9375-43c8-a981-8b2324c0447d,中正區,臺北市中正區市民大道三段2號,三創生活園區_哈亞極品咖啡,
c53429c0-be5d-49f7-8c11-332d653544b3,中正區,臺北市中正區忠孝東路一段12號1樓,台北喜來登大飯店-The Deli,The Deli提供每日新鮮現做輕食及熱食、各式手工烘焙麵包及甜點、寒舍集團旗下知名伴手禮，提供忙碌都市人帶得走的精緻美味。
c579eba9-612b-4b21-a340-77b982123687,中正區,臺北市中正區寶慶路32號5F ,遠百台北寶慶店-open for kid                  ,
c5a37ca6-860b-4a1f-a0d6-cf0279ca3901,中正區,臺北市中正區開封街１段２０之２號,伊立斯女僕咖啡,伊立斯女僕咖啡 台北快閃店 - 📍感受女僕用心親切的服務，放鬆治癒煩悶的心情💖 - 🎀可愛的女僕 🍴美味的餐點 🍀優美放鬆的環境 ✨WIFI
c60c49ba-d0f5-4ff6-bf06-4db399e06321,中正區,臺北市中正區臺北市中正區八德路一段5之2號,地標網通-台北光華旗艦店,地標網通一直是PTT， DCARD， Mobile 01網友最推薦、最信賴的通訊行。網友們常說：「地標是唯一能安心讓長輩獨自前往買手機和攜碼的店家」。這對我們來說，是至高無上的讚美，也欣慰長久以來的理念堅持終被看見被肯定。 我們以誠信透明聞名，產品皆是最優惠一口價，不會先打低價，讓您跑到現場再提出新購買條件。人生苦短，買個手機而已不需要如此多的複雜心機。 我們提供iPhone、三星、SONY、OPPO手機等市場最低空機價格、攜碼續約高優惠、高品質的保護殼和保護貼等豐富配件、貼心溫暖的服務，歡迎您來地標台北光華旗艦店！ 來店前歡迎先與我們聯繫，可先為您備妥所需型號
c64e88d1-a798-48e0-8844-4dc419a08db1,中正區,臺北市中正區公園路30-1號,麥當勞台北公園,"麥當勞是全世界最大的快速餐飲服務餐廳領導品牌。全世界超過100個國家、有近36,000家餐廳，每天提供超值美味的餐飲。更多麥當勞及最新產品資訊，請參考台灣麥當勞網站www.McDonalds.com.tw"
c69fd2d4-6d5e-44a5-8ca0-1f7aaa51830a,中正區,臺北市中正區衡陽路99號1樓,樂田-衡陽門市,【做好麵包。過好生活】我們樂於使用好食材、好製餡、好工法、好心意製作好麵包，創造美好生活體驗。
c6d14ab8-03c0-4f31-ae7d-d9d75449b027,中正區,臺北市中正區八德路一段1號,華山文創園區-知音文創輕食,華山文創園區-知音文創輕食
