ID,行政區,地址,店名,店家說明
af0400e7-7f4b-4282-884e-1b5d7d26aa24,北投區,臺北市北投區榮光里石牌路一段２００號,統一多拿滋股份有限公司石牌站門市部,甜甜圈源自媽媽對孩子的細心呵護，Mister Donut 延續這份用心，堅持每日新鮮出爐，持續研發多樣化的甜甜圈、引進北海道派、日本直輸和風糰子，以及嚴選100%阿拉比卡咖啡豆研磨的優質咖啡，讓您在舒適的用餐環境享受貼心服務與美味餐點。
af126c30-bbf0-458a-88b2-d6a03723da82,北投區,臺北市北投區關渡里關渡路５５號,社團法人台北市野鳥學會關渡自然公園管理處,關渡自然公園自然中心商品區台北熊好劵使用優惠： 1.使用台北熊好劵購買商品，滿200元送：特生海報一張                           滿500元送特生海報三張。 2.請開立二聯發票，並註記：台北熊好劵。 3.給予贈品請於發票上，蓋上螃蟹章以方便辨識。贈品數量有限送完為止 活動相關辦法，園區保留變更權益。
af54d351-fc56-4a9b-b6ab-9dea48a579e8,北投區,臺北市北投區裕民一路９號１樓,珉好實業社,日用品百貨零售
afcc2f21-8ccd-457a-8696-8238805676c9,北投區,臺北市北投區立賢里尊賢街２１１號,建成號冷飲站,來清心。喝好茶
b0c68b98-4e40-4370-8214-6a78616ac985,北投區,臺北市北投區振華里石牌路二段６４號,君城本家-石牌店,「君城」名稱的源起來自創辦人邱金城及夫人吳佩君胼手胝足的陪伴，一內一外的契合共同培育出溫暖誠摯的團隊， 始終堅持「新鮮、美味、好鄰居」的原則，懷念口味一直都在，創新元素也不斷堤升， 以細膩的手作觸感為老舖注入更多新意和驚喜。但不變的是四十年前的初衷，君城至今懸念在心。
b1bd6e47-39d1-4c6c-afda-bbe02a2f9a08,北投區,臺北市北投區中央里光明路７２巷６７號,歡喜寵物用品有限公司光明分公司,110/10/1~110/11/30歡喜寵物週年慶期間，全館回饋，消費滿額還可再 抽💝I PAD AIR、💝switch遊戲機、💝掃地機器人等超多項大獎等著您喔！
b22f6d32-37c9-47fa-a996-8fec3262a674,北投區,臺北市北投區七星街1號(新北投車站市集),藝巧熊 皮件,有著各式皮件，證件套、零錢包、長短夾、鑰匙圈 等等
b2efed8f-a5d2-47a8-be2e-314d8ac9a6ad,北投區,臺北市北投區大興街48號,Qburger 北投大興店,
b3751262-a1f7-44ec-87c4-919a16bfa1ac,北投區,臺北市北投區清江里崇仁路一段７７號１樓,Mina創意廚房.咖啡,從2010年開始，台灣經歷一連串的食安風暴，隨著外食族的增加，本身也是外食族的我，有鑒於此～ 開始思考，與其不相信外食，倒不如做一份為自己，為家人，都能吃得安心的料理。 於是在2016年的夏天「Mina創意廚房·咖啡」以守護家人爲出發點的理念，誕生了！  主理人Peter ～來自基隆的漁村，擁有20年日式懷石料理經歷的料理職人。 以「食用健康概念」堅持用新鮮的食材，烹調出美味的料理給大家
b4048e1d-7a10-4f5d-961e-02c0621cec7b,北投區,臺北市北投區石牌路二段93號1樓,Tomod's特美事-北投石牌二門市,Tomod’s 特美事創立於西元1993年，現於日本以東京為中心開設約200家分店，為日本首都圈內知名藥妝通路。 Tomod’s 特美事於2012年正式進軍台灣，至今日於全台已有眾多營業據點。秉持與日本Tomod’s相同概念，除了台灣現地化的商品外，更廣泛地集結日、韓、歐美等各國知名品牌及品項，提供給消費者更加多元的購物選擇。
b4439d2e-6ca8-403a-b52b-36a7b70e0f7f,北投區,臺北市北投區中央南路一段128號1樓,巧裕樂食品行,巧裕樂牛軋糖 CIAO YU LE 1990年 為創辦人開業元年 2004年 北投店「巧樂」正式開始營運 2020年 正式註冊為「巧裕樂」 並且以「巧手傳遞快樂」為核心，讓送禮及收禮的人都充滿快樂，並且堅持30年來的用心將最好的牛軋糖味道，傳達給來店品嚐的每一位客人，成為北投必買的伴手禮，火山豆口味牛軋糖更成為了本店30年來，最暢銷的產品。
b49bbba8-805e-48df-a10a-241b785198b9,北投區,臺北市北投區中和街35號1樓,寶島眼鏡新北投分公司,
b715eef0-b0ee-4726-8563-3b3ca9ba4e46,北投區,臺北市北投區中央南路１段１６號１樓,燈亮有餅-北投山東蔥油餅,傳承天母知名此燈亮有餅-忠誠山東蔥油餅創始人林老闆手藝，堅持每日現和麵、無豬油、無味素，提供美味又健康之蔥油餅。
b73e9b28-78a5-4f34-a4b1-40e290e94a87,北投區,臺北市北投區中央南路一段76號,春天藥品股份有限公司－北投營業處,◎ 專收新光、馬偕、長庚、榮總各大醫院處方箋，全民健保免費取藥 ◎ 各國名藥、用藥諮詢、健康食品 ◎ 醫學美容、美體專業護膚沙龍 ◎ 奶粉尿布、生活百貨、化妝品、婦嬰用品、居家護理
b749c7d2-8982-4d2e-9a6a-ad4c141bf79a,北投區,臺北市北投區台北市北投區自強街88號1-2F、92號1F,屈臣氏自強店,360度全方位服務：美妝、護膚、日用、健康！
b7e7a416-4577-4a96-94f2-07feaafa2371,北投區,臺北市北投區建民路161-5號1樓,Qburger 北投懷德店,
b8c1663c-c40e-4463-8c9a-af17ecb7435f,北投區,臺北市北投區振華里裕民一路４０巷２７號１樓,巧晨咖啡館,本店提供早午餐、中 / 義式料理、下午茶、甜點及金牌咖啡與飲品等，每日限量餐點好評熱銷中，歡迎臉書搜尋「巧晨咖啡館MattinaCaffe」或Line搜尋「@ero6303z」加入本店好友，有關最新特餐與其他消息會在上面通知
b997f50d-ce62-4fbc-9d9f-e6ebc9269050,北投區,臺北市北投區大同街202-4號1樓,湯花作,湯花作是以溫泉湯花為主體的創作坊，創新運用溫泉資源，創造湯花特產好物，向世界傳達北投的味道，體驗溫泉的力量。  火山硫氣與水蒸氣反應後形成硫酸，溶解土壤礦物質上升形成結晶遇水沈澱，即溫泉湯花。湯花是火山硫磺溫泉環境自然形成的類礦物，主要成分為硫，採集不易工序繁瑣，產量有限極其珍貴，1公噸溫泉水只能自然生成1公克溫泉湯花，溶解於熱水即成溫泉。  湯花作的北投溫泉湯花皂，皆含天然珍貴的溫泉湯花。手工冷
b9be0c48-20b2-4f18-80d8-676d4de02e99,北投區,臺北市北投區石牌路一段35號,岱妮蠶絲 石牌門市,岱妮蠶絲成立於西元1993年，憑著對蠶絲的「信念」與「熱愛」，岱妮不斷致力於技術的研發與創新，一次次的瓶頸，不滅我們對蠶絲的信心， 一次次的失敗，不滅我們對蠶絲的熱愛。
ba351c43-4068-4071-8b90-a81a4e30ea5a,北投區,臺北市北投區振華里裕民一路３０號１樓,烏弄-台北石牌店,烏弄台北石牌店 電話02-28282220 北投區裕民一路30號 現場消費買5送1 外送服務買10送1
ba834e86-c803-436d-910e-a2dbee1a1a60,北投區,臺北市北投區中和街297號1樓,狠雷早午餐店,位於台北市的北投區，《狠雷早午餐店》是當地人強力推薦的早午餐首選，無論是早上還是中午都會湧現絡繹不絕的人潮排隊等候著欲品嚐老闆的好手藝，用料實在、價格實惠，還提供豐富多樣的品項可挑選，吐司、可頌、義大利麵等皆是一應俱全，您將可在此獲得一番被美食所包圍的快樂，如此難得的機會又豈能輕易錯過呢~
bc6eb557-6a0f-4aab-b20f-530cce9757c2,北投區,臺北市北投區林泉里中山路３０－１０號２樓,地熱谷小舖庇護工場,本工場為北市第一間觀光行庇護工場，坐落於地熱谷風景公園內，擁有北部最美麗及自然形成的溫泉景觀，溫泉泉質屬青磺，為世界稀有泉質。本場販賣溫泉產品及地熱谷紀念品、特調咖啡及冰品，也是臺北世大運主要紀念品提供商。
bcc6350b-002c-4d31-b4cd-81d9af0b4f39,北投區,臺北市北投區石牌路２段９９巷３號１樓,時湜有限公司,初面位於台北市北投石牌，周圍有學校、醫院、社區活動中心等，提供美味可口的餐點，我們的番茄牛肉麵產品深受客人的喜愛，本著以客為尊為出發點，講究食材新鮮，舒適環境及用心的服務，獲得顧客的認同及肯定。
be692225-d40c-46c0-9310-cac985061c79,北投區,臺北市北投區關渡里知行路２９９號,85度C關渡知行店(榮哥商行),85度C 關渡知行店 咖啡蛋糕店
bea66ca4-23e8-470b-81b0-a0362b034343,北投區,臺北市北投區台北市北投區明德路365號第三學生宿舍大樓一樓,21PLUS 石牌,21PLUS、21風味館成立於1995年，招牌商品是21香草烤雞，嚴選國產鮮雞，使用21種香料入味，配合獨家烘烤技術，呈現鮮嫩多汁的獨家美味。扎實的產品力受到消費者的喜愛。持續開發符合現代人口味與健康需求的餐點，期待以速食店的價位與方便性，讓顧客輕鬆享受美味的幸福。
c040e086-95e8-4b23-bec2-a9eb866abf1b,北投區,臺北市北投區榮華里明德路２７７號１樓,亨奇食品器具行,台式餐點&烘焙材料行
c0ba54ff-2e5d-42be-b0c5-80f7b721d691,北投區,臺北市北投區吉利街１１４號１樓,COMEBUY北投吉利店,20年淬鍊，COMEBUY於2002年，從台灣台北市一家小店面創立至今，接軌世界，打造全球超過300家成功實證！ 用一杯創意好茶，帶給人類歡樂安心的使命 不斷創新、充滿熱情挑戰自己 將COMEBUY獨創的台灣茶飲文化帶進全世界 建立世界第一的COMEBUY
c0f23f2b-5228-4ee7-826e-c75641fec0e7,北投區,臺北市北投區天母西路132及132之1號,路易莎-天母米蘭門市,平價精品咖啡連鎖品牌LOUISA COFFEE，秉持分享一杯好咖啡的職人精神，提供多樣精品咖啡、義式咖啡、世界茶飲、招牌輕食，從早到晚都有咖啡香和無油煙餐食陪伴您！
c12b6905-df3b-46ce-8760-f55ebf9fae18,北投區,臺北市北投區長安里光明路２２６號,上享餐廳有限公司,新上享港式飲茶位於風景優美的北投溫泉區已有20多年歷史，可說是老饕級的美食名店。每一道料理都是由資深師傅精心烹調，加上每日新鮮進用的各式食材，顧客品嘗過後都讚不絕口，成為忠實粉絲。也因此才能成為當地老饕級的美食名店。  「新鮮、味美、價實在」是新上享秉持的經營理念，同時配合北投溫泉區的悠閒養生氛圍，主廚不定時研發養生創意新料理，可說是同業翹楚。新上享同時提供粵菜海鮮、日式冷盤、港式飲茶等多元選擇，
c2ed83ca-88fc-41de-be5a-954355ed2872,北投區,臺北市北投區榮光里致遠一路二段２號１樓,COMEBUY石牌致遠店,20年淬鍊，COMEBUY於2002年，從台灣台北市一家小店面創立至今，接軌世界，打造全球超過300家成功實證！ 用一杯創意好茶，帶給人類歡樂安心的使命 不斷創新、充滿熱情挑戰自己 將COMEBUY獨創的台灣茶飲文化帶進全世界 建立世界第一的COMEBUY
c4034fc2-70f5-4db4-b118-9ddefb65ffa3,北投區,臺北市北投區關渡里知行路３０６號,康是美智行門市,康是美藥妝店
c41db660-0819-466d-afd9-5871e73f5f53,北投區,臺北市北投區開明里中和街２３０號,復興通訊,Apple iPhone 現場維修 ‧ 實機體驗 軟體教學 · 週邊配件 中華電信/遠傳/台灣大哥大 亞太電信/台灣之星 新辦/續約/攜碼移轉 中古機還可舊換新
c4e49d44-00c6-45db-9b6b-6c48df8c2a34,北投區,臺北市北投區吉慶里實踐街７６號１樓,視界運動休閒用品社,本商店專營各類運動休閒用品，所販售商品皆為公司貨，有完整售後服務，請消費者安心選購
c563bfcc-a86f-4b4e-bcb2-c806744cb2d8,北投區,臺北市北投區自強街１２５號之８號,保成切麵店,生鮮麵條 涼麵
c5a750f0-6bf9-4d7a-906c-5f2549de8282,北投區,臺北市北投區中山路６號,北投公園露天溫泉,北投公園露天溫泉浴池位在北投公園中，以公園入口為起點，向地熱谷方向走，大概15分鐘就到了。  1999年12月才開放的園區，恰逢千禧年，所以又稱作「千禧湯」。佔地大概1000平方公尺，整體仿日式的建築設計，以原石、木材等自然材質為主，票亭跟廁間屋頂則用黑色文化瓦，洋溢著日式氛圍。  園區泉水源頭來自地熱谷，屬於一般人俗稱的青磺泉；六座大眾池依地勢高低分佈，四座是溫泉池、二座是冷水池，泉溫在38到4
c5d49925-1e29-48fc-a537-a61905d24ad6,北投區,臺北市北投區榮華里明德路１66號１樓,一二三冷凍食品有限公司,"123餃子對美食的堅持與熱情 不吝嗇的使用高價位食材配上由各種蔬果原汁調配的水餃皮 多年來精心研發出許多獨特的口味 最有特色的鮮蝦水餃、干貝水餃、鮑魚水餃、鮮魚水餃、紅麴水餃、養生素水餃、蛋皮小餛飩，不論在外觀、口感、都是獨一無二的。 123水餃更在2009年台北水餃節競賽中, 得到""天下第一攤""及""超人氣餃子王"" 的美譽。"
c758fee4-7e41-465a-b2d1-e627cd8dea73,北投區,臺北市北投區大同里大同街１７號,布拉克咖啡豆專賣店,專營精品莊園級咖啡豆、咖啡器具以及美味的咖啡
c7b5a527-d43c-41a5-a152-0d06693314e9,北投區,臺北市北投區振華里裕民三路３號１樓,路易莎-石牌門市,平價精品咖啡連鎖品牌LOUISA COFFEE，秉持分享一杯好咖啡的職人精神，提供多樣精品咖啡、義式咖啡、世界茶飲、招牌輕食，從早到晚都有咖啡香和無油煙餐食陪伴您！
c95b4731-d9ad-4c03-85f3-faa47b068ef6,北投區,臺北市北投區實踐街62號,荳荳小吃店,溫暖每一天 提供健康  營養  豐富的早午餐點 麥味登北投實踐店
ca263e1e-69e1-44a4-b8f9-e9c600e3289d,北投區,臺北市北投區石牌里致遠一路１段１１６號１樓,綠色小舖,有朋自遠方來不亦樂乎，是我們一貫的待客之道。舒適的環境，沒美味的食物，等你來細細品嚐
cb1762e2-cb37-496e-b804-39316b31919b,北投區,臺北市北投區長安里中央北路１段９８號１樓,85度C北投育仁店(成平美食屋),85度Ｃ 蛋糕咖啡烘焙專賣店
cd4bf52f-7de2-4e77-83d9-e1b857f1097f,北投區,臺北市北投區石牌路１段６號,仁輝水族舘,水族用品和觀賞魚販售
ce838a50-bcfa-49e9-8e81-cc973d1829b2,北投區,臺北市北投區中和街330號,小林眼鏡-北投店,因為用心，所以更好。
cf33effb-f528-4e6b-b419-37411a3dbd2e,北投區,臺北市北投區桃源里新興路１５８巷１４號１樓,百鍋匯,百鍋匯涮涮鍋 每日現熬雞底湯 健康低鈉，搭配豐富菜盤、優質肉品現流海鮮、冰淇淋飲料無限暢飲
cfb8e21e-a970-4af6-ba2a-ae14e8e5511d,北投區,臺北市北投區中庸里中和街２９９號１樓,福佑嬰童館,奶粉尿布超低價優惠 各大婦嬰用品享折扣 免費加會員超級方便
d1454025-d331-41fb-8395-c1dd67af3d60,北投區,臺北市北投區立農里立農街一段２６３號１樓,幸福角落巧食坊,✽嚴選食材                                                                                                                                          ✽在乎您吃的每一口                                     大餛飩 •抄手•麵•飯
d17f8750-032e-40a0-a587-eafc14faebf7,北投區,臺北市北投區大業路300巷18號1樓,及香手工水餃,純手工製作水餃，皮Q，餡香，有多種口味可以選擇，歡迎蒞臨。本店可使用［台灣pay］支付。
d2cb436a-7b7a-48a4-861d-17b84bbe1282,北投區,臺北市北投區洲美街２７１號,敘香園餐廳有限公司,高120公尺（約40層樓高）、每90分鐘旋轉一圈的摘星樓，是全球首座煙囪上的景觀旋轉餐廳，現場除了可提供各式美食佳餚外，還可居高觀賞關渡平原一帶的山川水澤，更可遠至林口台地、觀音山、陽明山、大屯山等美景！不論是傍晚時分的夕陽，或是夜幕中的台北璀璨夜景，在這裡都可一覽無遺。除了可以享受美食、欣賞美麗的景觀之外，現場有鋼琴演奏（唱），在美樂飄耳下觀賞夜景，的確是人生的一大享受！
d38668aa-711f-4778-b4c4-0b9c08c1b683,北投區,臺北市北投區磺港路33號A棟60～66號攤,北投齊鍋,北投新的中繼市場A棟，專售火鍋料冷凍食品，美味食材
d4584982-3a04-4d8b-9fe5-0e7e484961cc,北投區,臺北市北投區幽雅路31號,亞太飯店 北投館,北投亞太飯店請來日籍建築師廣澤榮一操刀設計，融合了北投在地溫泉與原民文化，建築外觀採用簡約黑白兩色，表現凱達格蘭族儉樸特性與北投溫泉煙霧氤氳之感。140間現代日式禪風客房，將日人泡湯文化落實在客房設計細節中，讓人有一秒到日本的驚喜感，透過暖色系實木家具、地板，鋪陳日式溫泉飯店低調奢華的細緻質感。
d5392990-01c2-4fab-9224-913e919f00f6,北投區,臺北市北投區大同里光明路３１號,康是美光明門市,康是美藥妝店
d7047c63-f0fa-4a8c-8793-3623a0320139,北投區,臺北市北投區台北市北投區磺港路8號,屈臣氏磺港店,360度全方位服務：美妝、護膚、日用、健康！
d7634581-f940-4475-b6cf-90be6a3b2554,北投區,臺北市北投區榮華里石牌路一段158號1樓,寶沛靴有限公司石牌分店,"買童鞋就是要到童鞋專賣店! 布布童鞋是0~12歲鞋款最多的童鞋專賣店也是最多媽咪們推薦的舒適選鞋環境  測溫消毒好安心 ,可過濾病毒空氣清淨機雙重保護  門市限定!!使用熊好券購買綠標鞋款再加贈品牌購物袋/口罩鍊"
d7c6600d-01de-4d1a-ba74-cab914ce9410,北投區,臺北市北投區榮華里明德路１５０巷１０號１樓,昇昇精品咖啡,"除了自家烘焙的精品咖啡,本店也有售有機蔬果,小農牛奶及放牧式的人道雞蛋..等等天然健康的商品,歡迎參觀選購!"
d97f1577-16a2-4f17-a2f0-c6e0e5fa4b9d,北投區,臺北市北投區中和街３９９之７號,宏昌寢飾行,五十年老店，為奧斯汀寢具經銷商，亦有其它品牌的寢具。其它經營項目有窗簾、拉門、壁紙、手工棉被、嫁妝百貨、彈簧床墊。
da88c723-02f1-4e1d-92f2-baf9b03c0ba4,北投區,臺北市北投區致遠一路一段95號,Qburger 北投致遠店,中西式早餐與早午餐餐廳
dabcb1ba-f4b2-43e8-a450-8fa9ef994fe4,北投區,臺北市北投區中和里中和街４５７－８號１樓,苗栗客家菜館,使用熊好卷來店消費招待一瓶古法熬煮 客家仙草茶
dc219a69-179d-48d6-ab79-ca53792c9657,北投區,臺北市北投區溫泉里11鄰光明路236號,日勝生加賀屋國際溫泉飯店,細膩貼心的款待服務，讓賓客感受無比自在舒適；徜徉天然白磺溫泉與北投石岩盤浴，帶來身心放鬆；精緻的日本會席料理，提供味蕾最豐富的滿足感。 日勝生集團將日本加賀屋原汁原味引進台灣， 座落於台灣最負盛名的溫泉區-北投，緊依台灣第一 家日式溫泉旅館「天狗庵」興建。全館空間以日本建築技法精細雕琢，綴以日本能登三大工藝品-九谷燒、 輪島塗、金箔，呈現日式典雅之美，讓所有賓客感受前所未有的和風體驗。
dd00fb41-e8d8-4193-822a-3d6e9b5c460e,北投區,臺北市北投區長安里中央北路一段１５０號,優適鑫眼鏡有限公司,本店有國考驗光人員專業驗光配鏡
df4862ae-ff29-421b-9cfe-f3f1b6eb5d9c,北投區,臺北市北投區榮光里石牌路一段２００號１樓,晶澈/晶碩光學石牌門市,隱形眼鏡販售
e01c2561-21a5-493e-afea-11f27e16ba75,北投區,臺北市北投區東華街2段122號1樓,昇揚通訊,手機現場維修專門店
e05c5cc8-71ce-4b80-acb7-a4adb3de74d5,北投區,臺北市北投區吉慶里石牌路一段９１號１樓,長庚生物科技股份有限公司台北石牌門市,長庚生技的品牌使命，是推廣楊定一博士所推廣的「真原醫」理念。 真原醫所倡導的是全面且完整的健康生活體悟，強調完全的療癒需要身、心、靈的徹底轉變，以積極的態度自我檢視並找回身、心、靈原有的和諧與美好。 我們生產的保健食品是結合最先進的科學與古人的智慧，開發出最天然安全、道地精萃且價格平實的保健食品與用品來幫助大眾健康。
e0be930c-0760-4b63-b498-6382bcc7e9a4,北投區,臺北市北投區致遠一路一段132號,春天藥品股份有限公司致遠營業處,◎ 專收新光、馬偕、長庚、榮總各大醫院處方箋，全民健保免費取藥 ◎ 各國名藥、用藥諮詢、健康食品 ◎ 醫學美容、美體專業護膚沙龍 ◎ 奶粉尿布、生活百貨、化妝品、婦嬰用品、居家護理
e1457161-4811-4172-8d9c-7265af13f2ac,北投區,臺北市北投區開明里中和街２９４號１．２樓,康是美新泉源門市,康是美藥妝店
e6320eec-f440-4774-b9f3-e5b3130675c8,北投區,臺北市北投區溫泉路１０８號,東皇大飯店,位於北投中山路、光明路及溫泉路三大叉路，東皇渡假旅店是由有唭哩岸之寶的唭哩岸石所建造而成，唭哩岸石屬於天然的好建材，住起來冬暖夏涼，十分舒適。正對面有一座綠意盎然的小森林，呈現了與自然相依的靜謐氣氛，讓您有機會能夠逃離都會生活，懷抱山林，迎接最純粹的休憩時刻！
e680508b-d077-4198-a5f8-b78e8b874f09,北投區,臺北市北投區中和街232號1樓,可不可熟成紅茶北投中和店,可不可熟成紅茶北投中和店 我們在台北市北投區中和街232號1樓 歡迎使用熊好券
e6b5185b-7260-48e9-acdf-08912e9abde4,北投區,臺北市北投區福興里致遠一路二段１２７號１樓,咖啡弄覓覓商行,台北市優質咖啡輕食館-咖啡弄位於北投區石牌的新型態悠閒小店
e87a9c62-f8da-4ab6-b720-6d5b678c2fdf,北投區,臺北市北投區中心里珠海路５號１樓,點焙工作室,無論夢想多大。 都是從一個最初的『點』開始出發。 一步步形成線。 最後畫為夢想的藍圖。 用簡單樸實無添加的點心與麵包，讓您感受真誠的意。
e8eb0630-dcb8-4fec-b63b-12e6950fbf7c,北投區,臺北市北投區中央北路四段534號1樓,麥當勞台北中央,"麥當勞是全世界最大的快速餐飲服務餐廳領導品牌。全世界超過100個國家、有近36,000家餐廳，每天提供超值美味的餐飲。更多麥當勞及最新產品資訊，請參考台灣麥當勞網站www.McDonalds.com.tw"
e9ca76e5-34ca-4155-9a0a-8a55c61df75c,北投區,臺北市北投區關渡里知行路３２８號,秘密花園精品服飾店,本店專營日本正版雜貨及服飾等，可使用熊好券，歡迎光臨!
eb2794df-26b6-4ea4-ad73-a7cc671cb8d2,北投區,臺北市北投區大度路三段296巷51號1樓-捷運關渡站內,樂田-關渡門市,【做好麵包。過好生活】我們樂於使用好食材、好製餡、好工法、好心意製作好麵包，創造美好生活體驗。
efb9bb65-ae77-4225-809e-f382a034cf9e,北投區,臺北市北投區中央里中央南路一段１２６號,展育體育用品有限公司 國旅卡特約店,本店鋪主要經營綜合性運動用品，也是國旅卡特約店！無論鞋、衣、運動器材、配件等樣樣齊全，我們已在地經營服務超過10年以上，如有需要運動用品的市民朋友歡迎來店參觀選購喔！！
f2072775-18d2-4149-9582-88d44db0a1c5,北投區,臺北市北投區大興街２３巷２１號,上清料理,善意的食物 善意的環境
f3026035-81bf-44e8-9407-3fe22cc98a22,北投區,臺北市北投區大同里北投路２段２５號,翰諾國際有限公司-北投戶外,"有關於登山,戶外,玩樂的都可以找我們喔!"
f3dbd6bf-1380-4329-9c6f-af6388735134,北投區,臺北市北投區豐年里中央北路２段２４５號,八豆咖啡商行,新鮮咖啡豆掛耳包黑咖啡，堅持選用100%優質純正阿拉比卡豆烘焙。歡迎您的光臨與選購!
f4314d54-af0d-4166-9ed4-90d784f1c057,北投區,臺北市北投區振華里石牌路二段７０號,亞尼克北投石牌店,亞尼克對食材的挑選專注窮究，注重結構與味道的合諧美味。一秉對食材、新鮮、製程的堅持，不斷研發、創新及傾聽顧客的心。打破傳統以來好蛋糕必須高價位的刻板印象，用更高品質、高成本的原料，以最平實的價格提供給顧客。
f6fcc9f9-ca59-4151-bd27-86f24a1638c6,北投區,臺北市北投區長安里光明路１４８―１號１樓,轉角小市場,現做風味餐 義大利麵 焗烤 素 蔬食  咖啡  果汁 輕食  豆奶 冰沙
f71e13b8-ead1-4da0-9dec-25c364a15731,北投區,臺北市北投區台北市北投區大同街202之4號,彩智工作室,你好我們是北投網路批發商品特色與眾不同!歡迎大家來逛逛喔!
f83619e6-530e-42e2-85a0-313c9171d534,北投區,臺北市北投區承德路7段262號1樓,麥當勞台北承德二,"麥當勞是全世界最大的快速餐飲服務餐廳領導品牌。全世界超過100個國家、有近36,000家餐廳，每天提供超值美味的餐飲。更多麥當勞及最新產品資訊，請參考台灣麥當勞網站www.McDonalds.com.tw"
f8c1fd71-2094-4029-878f-554ba5bbbba9,北投區,臺北市北投區磺港路33號B2棟140-142號,阿蕊水果柑仔店,販售時令新鮮水果、精品水果禮盒、精品水果籃。
f8eedb23-309e-48eb-aa00-d1f571dc5a25,北投區,臺北市北投區西安街二段193號,美都髮廊,時尚造型剪、染、燙、頭皮養護、產品一應俱全。歡迎蒞臨
