ID,行政區,地址,店名,店家說明
004c5ec5-e76b-43d4-a069-9daef7bc7306,北投區,臺北市北投區湖山里建國街４號,運博國際股份有限公司建國路前山營業所,池水為陽明山之山泉水，無論天熱天冷，池水永遠沁涼透心。
00df8b84-a909-44b2-a3d1-ce1ea2a5d144,北投區,臺北市北投區石牌路2段126號,麥當勞台北石牌,"麥當勞是全世界最大的快速餐飲服務餐廳領導品牌。全世界超過100個國家、有近36,000家餐廳，每天提供超值美味的餐飲。更多麥當勞及最新產品資訊，請參考台灣麥當勞網站www.McDonalds.com.tw"
013c06e5-f927-4027-badd-8989d1a2192b,北投區,臺北市北投區振興街１９號１樓,達康醫療器材-開水實業有限公司,達康醫療主要為－長期照護用品、醫療用品、呼吸醫療器材、銀髮健康用品、營養保健食品等，為主要營運項目。 實體店面位於台北榮總與振興醫院的中間位置，您可以透過門市或電話詢問所需要的醫療器材。 若您有醫療器材購買洽詢或醫療輔具上的操作使用問題、產品維修問題、衛教諮詢或租賃需求，歡迎您與我們連絡。
032eb91b-367f-45cd-9ef3-7891d4cbf9ad,北投區,臺北市北投區一德里立德路１５號２樓,天仁茗茶 華碩店,天仁茶業股份有限公司 天仁茗茶以「老行業、新經營」為願景，不斷加強產品研發與創新服務，透過感動服務傳遞品牌價值，賦予「茶」更多元與生活化的內涵。
03697fd4-4bf2-465e-bb03-5235f6b53394,北投區,臺北市北投區大度路三段270巷73號,小島田TOGO 關渡店,"-小島田·刈包 GuaBao- 鬆軟的刈包皮夾著滷肉和滿滿的炒酸菜及花生粉層層驚喜口感豐富，美味在嘴裡慢慢地化開，深受著大人與小孩們的喜愛。  -手工脆皮泡芙 Choux- 手工現灌泡芙，泡芙外皮香酥脆，一口咬下香濃的鮮奶卡士達更是讓人覺得幸福滿滿～!  -鮮榨果汁Juice- 選用當季台灣小農水果鮮榨出香純濃果汁,營養好喝又健康。  -台灣好茶Tea- -illy咖啡-"
044218ef-82d3-4d5d-97b5-b2d72d0e14fe,北投區,臺北市北投區立農街二段259號1樓,Qburger 北投立農店,Q Burger饗樂餐飲創立於2013年， 是由一群熱愛早餐的年輕團隊組成，創立初衷：「成為台灣引以為傲的國際品牌」。 同時也致力提供年輕人一個良好的薪酬福利及工作環境，並打造「新穎」、「舒適」、「明亮」的用餐環境，提供「優質」、「精緻」、「平價」早午餐，讓顧客享用最有溫度的餐點。
05062310-35bc-479b-bdb9-698a958c5590,北投區,臺北市北投區福興里自強街５巷１６３號,悅心緣素食坊,位於石牌巷弄平價美味素食自助餐
05451baf-5773-4e0f-a278-e4c0617b1901,北投區,臺北市北投區清江路２５巷６４號１樓,麗斯特廚具行,在地經營三十幾年，專賣油煙機、瓦斯爐、熱水器及㕑房設備、衛浴設備
08a85db6-66ef-4435-af03-8c911b93c9a6,北投區,臺北市北投區榮華里天母西路１３２-１３號,咖啡燕咖啡館,位於石牌的獨立咖啡廳 用心準備每一杯好咖啡
0da9b93a-a2e7-4257-950b-b04c0272b818,北投區,臺北市北投區台北市北投區清江里新市街30號1樓中繼市場252號,繪椿商行,手足保養 凝膠彩繪
0e88e970-4a7a-4117-be3f-62020b124fb7,北投區,臺北市北投區東華里立農街二段２６９號１樓,日日文創舖,各位同好大家好： 日日文創舖位於陽明大學山腳下。 日日容納各式文房具及文創小物，期待成為一個溫暖舒適的文創環境供所有愛好們彼此交流～ 同時，日日也準備了從日本空運來台的一番賞與新款扭蛋與大家同樂！ 期待各位能夠享受在日日的時光🤗
0f2e4f48-e26e-47ac-9e7f-9981dda656d8,北投區,臺北市北投區中和街22號,路易莎-新北投直營門市,平價精品咖啡連鎖品牌LOUISA COFFEE，秉持分享一杯好咖啡的職人精神，提供多樣精品咖啡、義式咖啡、世界茶飲、招牌輕食，從早到晚都有咖啡香和無油煙餐食陪伴您！
10e7ea1a-f2e2-4d66-84dc-c0d34ec74808,北投區,臺北市北投區吉利街120號,春天藥品股份有限公司吉利營業處,◎ 專收新光、馬偕、長庚、榮總各大醫院處方箋，全民健保免費取藥 ◎ 各國名藥、用藥諮詢、健康食品 ◎ 醫學美容、美體專業護膚沙龍 ◎ 奶粉尿布、生活百貨、化妝品、婦嬰用品、居家護理
10f3dfb1-ab95-4ed8-ba00-5ee5ed700fd4,北投區,臺北市北投區榮光里石牌路一段１６４號,COMEBUY石牌國中店,20年淬鍊，COMEBUY於2002年，從台灣台北市一家小店面創立至今，接軌世界，打造全球超過300家成功實證！ 用一杯創意好茶，帶給人類歡樂安心的使命 不斷創新、充滿熱情挑戰自己 將COMEBUY獨創的台灣茶飲文化帶進全世界 建立世界第一的COMEBUY
12f58b84-b7c8-44bd-9b1e-661da8ab3b2f,北投區,臺北市北投區石牌路二段122號1樓,花月嵐 北投石牌店,日本NO.1！史上最強的排隊名店，堅持日本原汁原味，濃郁而豪邁的重口味，在台灣也深受拉麵迷喜愛。自信之作〈大蒜拳骨拉麵〉使用豬前腿拳骨、上選大蒜，熬煮出獨特而濃厚的秘傳湯頭，搭配現擠生鮮大蒜更添層次口感。
13176041-ed38-4a54-9645-771586f4b931,北投區,臺北市北投區立德路115號3樓,12MINI北投華碩店,隨時迷你，美味隨你！ 主打一人獨享平價美味鍋物，湯頭超好喝、用料很實在，內用、外帶、外送都能吃得安心又美味！ 鍋物提供【漿漿好】、【菜菜好】版本，不管你今天想吃菜還是火鍋料，都能隨心所欲自由選！  王品集團寵愛會員無極限！加入王品瘋美食App，會員現領＄100吃飯金、獨享瘋點數最高8%回饋、瘋點數1點抵1元折抵無上限！旗下中餐、日式、韓食、異國、火鍋、燒肉及鐵板燒料理，全台300間餐廳任你挑選，吃什麼都有瘋好禮！手刀下載: https://wowfoods.cc/taipeipass 以上優惠條件及活動限制辦法，依品牌官方網站公告為主。
150c756b-7cef-4dde-9461-7d13a7e48252,北投區,臺北市北投區新市街６９號,國豐食品行,台灣北投在地老店；肉鬆、肉乾、最佳伴手禮！
15cf4e4d-9437-401e-84be-d2ae8925c7aa,北投區,臺北市北投區中庸里中和街３３５號,85度C北投中和店(禾定豐商行),85度C咖啡蛋糕店
168abd12-3ec1-4cf8-a57d-36444fc21c19,北投區,臺北市北投區一德里中央北路四段３０１號,Phone Case瘋殼子忠義店,"瘋殼子(PhoneCase)成立於西元2011年 為消費者追隨手機優質的視覺饗宴,提供消費者各式良好的服務平台,由實體門市延伸至網路門市,並以平價且親切的服務態度行銷,擁有為數不少的客戶群。  邁向多項業務發展其中包含 ◎各型號手機周邊配件零售◎手機相關產品配件零售◎專業精準貼膜◎全機精美專業包膜◎專業維修業務等  本公司擁有優秀的經營團隊,秉持著『Phonecase包辦您的手機大小事』經營理念,"
16c28ef7-349c-4c85-8d41-5832321092f5,北投區,臺北市北投區懷德街16號,雙喜烘焙坊,店內商品皆可以使用喔～
19101807-f3ff-48a4-87a1-c0d9ecbf88fb,北投區,臺北市北投區光明路217號2樓,陶板屋北投光明店,提供滿足全家大小，多樣口味選擇，悉心打造的和風洋食料理，以當季食材，將西餐融入職人精神的日本料理手法，邀您一起開啟家人的美味關係！  王品集團寵愛會員無極限！加入王品瘋美食App，會員現領＄100吃飯金、獨享瘋點數最高8%回饋、瘋點數1點抵1元折抵無上限！旗下中餐、日式、韓食、異國、火鍋、燒肉及鐵板燒料理，全台300間餐廳任你挑選，吃什麼都有瘋好禮！手刀下載: https://wowfoods.cc/taipeipass 以上優惠條件及活動限制辦法，依品牌官方網站公告為主。
19e80503-98b8-4a3c-a249-9677357f333c,北投區,臺北市北投區關渡里知行路２８１號１樓,金李朴韓國小館,營業時間:12:00-13:30                    17:45-20:00                 每週三四公休
1bcb96ad-0cc9-478f-89a8-94a3ed7e78b4,北投區,臺北市北投區湖田里竹子湖路５６―７號,苗榜花園餐廳,在私人花園旁的餐廳，在享用餐點的同時有著美麗的自然景觀。
1c7f55a4-5471-4de1-b20b-82d149e13d3d,北投區,臺北市北投區磺港路8號4樓-8之1號4樓,Curves北投店,"Curves是專為女性設計的30分鐘環狀運動。 我們提供給女性簡單、快速又有效的運動方式， 透過有氧+肌力+伸展三合一的完整訓練， 在女性教練的陪伴之下，輕鬆養成運動習慣， 讓妳更健康、更自信、更快樂 ，是妳開始運動的第一選擇。 *免費預約體驗 https://www.curves.com.tw/ *免費預約專線 02-2893-6585 *請提前主動告知使用""政府優惠券"", 店家保留最終活動抵扣"
1d74398b-ee67-41f5-9834-652ffae20703,北投區,臺北市北投區長安里光明路１１５號,COMEBUY北投溫泉店,20年淬鍊，COMEBUY於2002年，從台灣台北市一家小店面創立至今，接軌世界，打造全球超過300家成功實證！ 用一杯創意好茶，帶給人類歡樂安心的使命 不斷創新、充滿熱情挑戰自己 將COMEBUY獨創的台灣茶飲文化帶進全世界 建立世界第一的COMEBUY
1dff96ba-701b-43a0-bbaa-9ea66942bacf,北投區,臺北市北投區八仙里大業路１０號地下一樓,逗創意有限公司,創立於 2018 年的 DoBo逗創意 傾心「打擊樂」多元與熱情的鮮明個性 致力開發製作優質的音樂文創商品 希望透過「音樂元素」為文創商品設計 注入更多自由的溫度 由簡單的音樂元素延伸到生活周邊商品 從角色文創商品到專業音樂週邊 除了原創設計亦由專業樂團擔任評測 無不希望支持 DoBo逗創意 的愛好者 都能開心體驗，安心使用 同時發現生活中每一顆跳躍的音符
1e886d94-9e36-448d-98d0-1a2891747de0,北投區,臺北市北投區永明里石牌路２段１８５號,高博士國際有限公司石牌店,DK鞋子是有生命的，就像心臟會跳動，人體會呼吸，這樣的理念值得他努力一輩子」，古人說:有錢人造橋舖路做功德，我們奉獻自己的專業，做好每一雙鞋給人穿。鞋子穿得好，身體自然好，這就是造福人群做善事。 期許自己要做就要做第一名的鞋子，高銘村董事長創新腳步不停歇，他以汽車、手機等配備日新月異的態度和速度做鞋子，希望有朝一日台灣每個角落都有DK呼吸空氣鞋在跳動著。
1fbb35b9-e6fe-45c9-b5c6-cdddcaec9e93,北投區,臺北市北投區行義路139號,草山堂商行,原木、台灣檜木用品(精油、浴桶、泡腳桶、水瓢)、蜜香紅茶、高山烏龍、越南沉香線香
1fd6b11f-9103-4263-b245-1ccf904cb143,北投區,臺北市北投區明德路365號1樓,Cuiqu Coffee奎克咖啡-台北石牌店,期許能用最短的等待時間萃取最優質的飲食品味，將最好的呈現給你。 用一杯好咖啡，品味生活裡的幸福當下， 偶爾停下腳步短暫喘息，會發現生活中的美好， 盡情享受悠然時刻，生活不單是遙遠的目標。 堅持選用頂級莊園咖啡生豆自家烘焙， 用「態度」實踐好咖啡的純萃。 堅持使用健康天然，不添加人工香料的新鮮食材， 用「真誠」對待你所在意的事。 用喝的時尚品味與享受質感生活。
201390ce-7864-4c15-9609-88edd687fc24,北投區,臺北市北投區一德里中央北路４段４５０號１樓,茉兒書局,"圖書全面85折,預購圖書79折起,美術材料琳瑯滿目,紙材豐富"
240dc4d7-afea-48a7-80d4-f4cdbea1ff8c,北投區,臺北市北投區振華里裕民一路１１號,可不可熟成紅茶石牌裕民店,可不可熟成紅茶石牌裕民店 我們在 台北市北投區裕民一路11號
2430814d-f230-4fb0-a389-47d524d682c5,北投區,臺北市北投區明德路77號,寶島眼鏡明德路分公司,
278cef02-a8ce-4da0-a7de-eab96db815d1,北投區,臺北市北投區石牌路２段１０６號１樓,和真眼鏡有限公司,🔥和真眼鏡  ✅我們一直以 #專業配鏡 為導向 ✅堅持 #精密光學參數量測 ✅透過高階儀器設備量測 ✅提升→精準度、便利性、精密感 ✅了解眼睛狀態！圖像顯示多樣數據  ▪ 預約專線：(02)2825-0179 ▪ 線上預約：https://eyebooknow.tw/TW00000090
2a37d93d-96db-4134-87d7-5a31a2ed2db3,北投區,臺北市北投區大同里大業路４６２號,熱風精品咖啡豆,熱風精品咖啡豆是烘天雷國際商貿有限公司旗下的品牌門店。主要提供「現場選擇生豆，即刻烘焙」的全球各產區精品咖啡豆服務。也提供各式咖啡沖煮器具，商業烘豆機，以及店內品嚐精品咖啡的服務。
2a9e2ef2-9720-45b9-8852-bd7f909910d4,北投區,臺北市北投區實踐街２３號１樓,廣奕堂書局,圖書.文具.禮品.玩具.美術用品.種類齊全......
2ab70b65-ffa9-4b8f-98d4-47dff488f072,北投區,臺北市北投區福興里承德路七段3號,順益汽車股份有限公司士林營業所,經營汽車銷售
2ccbe456-0e81-494e-936b-098801868a41,北投區,臺北市北投區七星街1號(新北投車站市集),人山艸,【人山艸】嚴選關西陳年仙草乾，堅持採用「不添加鹼粉（碳酸鈉）」長時間熬煉的方式，萃煉出富含植物多酚的【人山艸仙草茶】。冰鎮口感佳、熱飲風味足；亦可入仙草料理：仙草雞湯、仙草炊飯等。還有天然無鹼味的【人山艸燒仙草/凍(沖泡包)】沸水沖泡攪拌均勻，熱飲即是燒仙草，放涼冷藏即是仙草凍。新北投市集：每月第三週六日、第四週六日。更多市集資訊：LineID：@uxo2792f 或02-66173639。
2cd3a4c6-5abb-4416-8f75-d116e83c6db4,北投區,臺北市北投區中心里七星街１號,新北投車站,日治時期為發展新北投地區溫泉觀光產業，興建新北投支線，於1916年(大正5年)設置「新北投乘降場」後改稱為「新北投驛」， 新北投地名，由此而生。新北投車站為北淡線甚至是臺北市僅存的百年車站，其站體為木造結構，簷架下的雕花托座及1937年因擴建站體產生的3+1組合老虎窗， 為車站建築一大特色。 然1988年因北淡線停駛而走入歷史並將站體拆遷至彰化台灣民俗村。
2d8c3a60-e395-4a61-923c-0437a3ab93d2,北投區,臺北市北投區裕民一路30號2樓,Curves石牌店,Curves是專為女性設計的30分鐘環狀運動，結合有氧、肌力、伸展三合一的完整訓練，我們承諾提供一個充滿愛與支持的環境，從運動開始，讓所有接觸到Curves的人，勇於蛻變綻放價值。
2e946d2a-526a-4be1-bb2d-4ce376756785,北投區,臺北市北投區清江里三合街二段４５５號１樓,百吉堡,早午餐
2f2e8419-6fcc-453f-ab23-a51c4c673501,北投區,臺北市北投區裕民里東華街一段３８８號１樓,泰蓁緣泰式料理,1.「內用」單筆消費滿千，且使用5張饗購券打9折。 2.「外帶自取」單筆消費滿750元，且使用3張饗購券打9折。 📍煩請務必事先告知店家想使用饗購券，謝謝您。
2fc01655-9cd8-404c-a44c-77e54a9d3b24,北投區,臺北市北投區磺港路８號１樓,香港商捷時海外貿易有限公司台灣分公司北投門市部,休閒服飾專賣店
334fdead-21a9-458d-9358-ca72a7beb0a2,北投區,臺北市北投區榮光里石牌路一段１４０號１樓,二結坊,小木屋鬆餅石牌店 美味鬆餅、現調飲料~休憩舒適空間~cp值高
3acbb3c5-2ec5-4a05-8443-c2ef0b6c7f25,北投區,臺北市北投區大同里光明路１號,Phone Case瘋殼子北投店,"瘋殼子(PhoneCase)成立於西元2011年 為消費者追隨手機優質的視覺饗宴,提供消費者各式良好的服務平台,由實體門市延伸至網路門市,並以平價且親切的服務態度行銷,擁有為數不少的客戶群。  邁向多項業務發展其中包含 ◎各型號手機周邊配件零售◎手機相關產品配件零售◎專業精準貼膜◎全機精美專業包膜◎專業維修業務等  本公司擁有優秀的經營團隊,秉持著『Phonecase包辦您的手機大小事』經營理念,"
3c2ac1b9-4b9d-447f-a5e3-e54d4f040ec2,北投區,臺北市北投區光明路２１８-３號,麥當勞台北北投,歡迎大家光臨北投麥當勞餐廳
3f21fef5-2ba6-4cc5-8a7e-c12bee4c41c9,北投區,臺北市北投區台北市北投區光明路223、223-1號,屈臣氏北投店,360度全方位服務：美妝、護膚、日用、健康！
423f2525-67fa-43d3-9b9a-4f5570929520,北投區,臺北市北投區光明路65號1樓,路易莎-北投社3rd直營門市,平價精品咖啡連鎖品牌LOUISA COFFEE，秉持分享一杯好咖啡的職人精神，提供多樣精品咖啡、義式咖啡、世界茶飲、招牌輕食，從早到晚都有咖啡香和無油煙餐食陪伴您！
468e175a-2524-4991-bfec-ce5139f0196c,北投區,臺北市北投區幽雅路18號1-6樓,春天酒店,北投春天酒店，近「大磺嘴」源頭，終年提供頂級白磺原湯，因溫泉呈乳白色，而有牛奶湯之稱，館內擁有多功能設施：雅緻設計及觀音石浴池的客房住宿、多功能SPA露天風呂、不同風格客房式及室內湯屋、日式美食餐廳、主題會議假期、戶外婚禮等服務。
46aab687-142c-4829-a335-be26b9d1f1fc,北投區,臺北市北投區中央里中央南路一段１４號,格情百貨行,華歌爾全系列商品 運動內衣 游泳衣 睡衣 男士內衣褲系列
48085723-61a0-49be-9931-a5a79207b562,北投區,臺北市北投區永明里義理街２８號１樓,筌曜樂器批發,🎻筌曜樂器批發倉庫🎻 經營25年來以高品質、服務、最低價為宗旨。 🎹樂器種類最齊全，現貨達2000多種商品 包含各類進口配件：弦樂、管樂、鍵盤樂、打擊樂、流行樂器、國樂器、各式電子節拍調音器等等，應有盡有👍 另包含各項樂器買賣、租借、教學、維修🔧
48994759-1be7-4fe5-ba13-5f714351d704,北投區,臺北市北投區大同里大業路５０６號,LANEW台北大業店,LA NEW！最懂東方人腳型的製鞋專家  LA NEW為專業健康休閒氣墊鞋第一品牌，國內第一家標榜「先量腳，再選鞋」，以完整的直營門市及專業的量腳服務團隊服務消費者，結合LA NEW足部研究所專為臺灣人腳型提供舒適的穿鞋體驗！
49f7cd8d-0af7-47c7-9c22-7889427a2a58,北投區,臺北市北投區榮光里自強街１１５號,建成貳號冷飲站,來清心。喝好茶
4a329fee-b56c-49a2-aaee-54c442996cf9,北投區,臺北市北投區石牌路２段８８號,創義麵石牌店,因為喜歡義大利麵，所以想要創造屬於台灣人的義大利麵，於是「創義麵」誕生了。 我們希望能引入義大利麵的享用文化，除了提供高水準、風味獨特的用餐體驗，成為你我心目中comfort food的代表；同時致力於打造輕鬆舒適的空間，踏入店內更能感受到親切溫暖的服務。讓進來的每位朋友不用拘泥用餐禮節，像是回到秘密基地般放鬆自在。 所有麵點都採用現煮麵，口感Ｑ彈帶有麵香；還有獨創季節料理，以台、義家常菜色為靈感
4d358859-a239-415c-a7fe-52671a123d50,北投區,臺北市北投區石牌路二段124號,龜記石牌店,石牌地區好喝的飲料，特色飲品紅柚翡翠，每一口都喝得到葡萄柚果粒！
4e94272e-3fc5-4de2-8b79-9f1f33cb2845,北投區,臺北市北投區榮華里明德路１７２號１樓,小丁豆漿店,消費滿150元，贈送大杯豆漿ㄧ杯
505d5a8a-2755-4189-8012-4b1bb1aeb8d9,北投區,臺北市北投區大同里育仁路５８號１樓,悠弦樂器,悠弦提琴 •樂器 U.String music 創立於2020年10月 兼具提琴買賣、租借、維修、各國進口琴弦、進口配件零售等服務。擁有法國進口bam琴盒北區最大展示空間。另提供各項樂器師資、對外琴房租借、室內樂團練、小型舞台講座、小型 學生發表會之展演空間，歡迎蒞臨指教及參觀選購
51900c63-b30d-4b11-ad45-932f6d893287,北投區,臺北市北投區裕民一路40巷33號1樓,迷客夏石牌店,冬季飲品 焙茶鮮奶 焙茶厚鮮奶 伯爵可可拿鐵 布朗紅茶拿鐵 暖心上市
51b04346-86b0-472b-82c9-55c78f2c3a54,北投區,臺北市北投區立賢里承德路七段２９２號,橡木桶洋酒股份有限公司石牌分公司,最齊全的世界名酒專業代理，西元1991台灣省菸酒公賣局開放威士忌進口，從此開啟了橡木桶洋酒代理酒類的序幕  1993 年橡木桶洋酒有限公正式成立，接著我們成立了第一家連鎖門市 - 橡木桶洋酒松江旗艦店 ！至今已達到了全台33家門市！遍佈北中南，成為全國最大連鎖洋酒量販！
51f46e76-a450-40c2-aa3f-2234ad3b1473,北投區,臺北市北投區湖田里竹子湖路３３－１１號,大梯田花卉坊,位於陽明山竹子湖，是一座梯田式的繡球花園！ 3-4月是紅楓季，滿谷楓紅，5-6月是繡球花季，映入眼簾的是一層層有高有低的梯田。 春夏，梯田色彩繽紛，如萬花筒般的絢麗花海。 秋冬，置身在空靈山谷，感受蕭瑟的美感，是沐浴身心靈的最佳去處！
51fdc804-e92c-436a-b5a6-d41914b858ae,北投區,臺北市北投區磺港路33號222攤位,來來製麵所,北投市場傳承第二代40年老店，專營水餃皮、餛飩皮、拉麵、陽春麵、油麵
53e50a44-efb4-450b-a829-56d33cae30e1,北投區,臺北市北投區中庸里永興路一段４７號,酒米食堂,提供日式串燒、炸物、丼飯、讚岐烏龍麵、生啤酒……等美食，等待各位光臨～
5445a3fa-b9ae-4b28-8500-d0770d1b8fdb,北投區,臺北市北投區台北市北投區知行路222號1-2樓,屈臣氏知行店,360度全方位服務：美妝、護膚、日用、健康！
54b8c06b-0a53-4caa-a221-58bb91372793,北投區,臺北市北投區中央里磺港路１０號１樓,新生活書局-北投店,新生活書局流行館於民國80年第一間店於北投開幕。販賣書籍、文具為主的書局文具店。舒適購物環境，更提供多元支付方式，給您更便利的購物體驗。
553abea2-f657-490d-87ed-2b1ce3c1adba,北投區,臺北市北投區東華里立農街２段２９３號１樓,三榕商號,我們是位於石牌的咖啡館，附近有榮總、振興兩間大型醫院，以及陽明交通大學和護理健康大學兩所大學，店內主要販售咖啡、茶飲和輕食為主，營業時間為早上八點至下午三點。
5572db0f-b98f-451f-9ccb-01763a7fc34b,北投區,臺北市北投區泉源路12號,爭鮮迴轉壽司新北投店,超過80款盤盤精彩的壽司與小菜，透過迴轉台一一呈現在顧客眼前，實現顧客與美食零距離。每盤30元的親民價格，期許更多人能和我們一起愛上壽司。
557ba702-bc9b-4d3f-b621-e91d4db73a1c,北投區,臺北市北投區東華里東華街二段３８０號１樓,有河文化有限公司,有河書店位於捷運淡水線唭哩岸站1號出口，出站後3分鐘即達。店內販售以新書為主，並供應咖啡、茶等飲品，不定期舉辦各種講座或文藝活動。
56766205-39ce-45e1-973e-2bf0798df8d0,北投區,臺北市北投區台北市北投區石牌路二段76號,屈臣氏石牌店,360度全方位服務：美妝、護膚、日用、健康！
57b67686-03c8-43e3-9ad8-51cb395de6c8,北投區,臺北市北投區湖田里竹子湖路１-２０號,石尚自然探索屋陽明山店,憑台北熊好券 門市多種優質商品 歡迎入內參觀選購！
57baa2fb-f882-4c86-bc12-ad5e76704678,北投區,臺北市北投區關渡里大度路３段１６５號,喬大社會企業股份有限公司,"里仁致力於有機食品及用品推廣,廣為大眾信賴,從慈悲心出發,秉持""誠信互助感恩""的核心價值,以契作保障有機耕作農友;與廠商合作開發安心商品;鼓勵本土有機天然食材,減少「添加物」及加工層次；杜絕人工香料、化學色素、合成防腐劑,實踐友善大地的信念.里仁期許與農友、廠商及消費者,以誠信心手相連,善待環境、用心生產,提供好物,呵護消費者健康.歡迎您一同加入友善環境的行列,共同串起互助的良善循環."
59c57d41-d931-4055-9fa1-b16db37fc03b,北投區,臺北市北投區文林里致遠一路一段１３３號１樓,北投車行,捷安特自行車經銷商 各類單車販賣與銷售 自行車相關產品銷售 單車修理及保養
5a71c448-29da-408b-8ca8-a6315cb1ce49,北投區,臺北市北投區光明路283號,水都溫泉會館,座落於地熱谷旁的北投水都溫泉會館，樸素外觀帶有日式簡約風情的雅致，擁有優質硫磺泉，屬特殊泉質，富含多種微量元素，享受泡湯時，宛如死海般的礦物在保養著每一寸肌膚，享受最極致的美體感受。館內結合多種溫馨舒適溫泉客房，可以如湯屋般短暫停留，更歡迎入住一晚以上體驗盡情享受泡湯樂趣，尤其位於本館頂樓【露天風呂大眾】適合親子或家庭一同同樂的泡湯，極簡的空間中也可讓需要會議及套裝行程的貴賓完成需求
5a76d384-d885-409e-9d7f-0a8326f0e7e6,北投區,臺北市北投區立德路2號,互愛人文志業股份有限公司關渡營業所,"靜思書軒位於大愛電視台一樓,期待提供人們一個沉澱心靈的處所,透過周遭的氛圍及書香.茶香.咖啡香.人文香,品味心靈香,享受悠遊書海. 除了書籍以外,更有影音.環保生活用品.食品.文具精品"
