ID,行政區,地址,店名,店家說明
fb4c4292-d3d1-4de8-8ee6-2d087a9e676c,北投區,臺北市北投區吉利街39巷9號1樓,卡爾登西服,39年經驗老店，一開始從少男裝做起，後來轉作中男西裝，這十幾年來服務過各式各樣的客人，即便是特殊身材、大尺碼都能在我們這裡找到解決方案！  不同於一般人對成衣西服的刻板印象，卡爾登的西裝版型能近乎完美地貼合各種身型，滿足大多數的客人需求。此外還能免費修改褲長、褲圍，根據個別要求，做更細節的客製修改哦！(加價購)  販售商品：西裝、西褲、襯衫、領帶、領結、領帶夾、皮帶、皮鞋、polo衫、大衣、包包等
fc368d41-ccf2-4999-89cc-ec5d2a9f6163,北投區,臺北市北投區中央里新市街７１號,北投齊雞雞鴨店,北投齊雞的雞肉一律採用放山式的養殖，選擇較無污染，且水質及空氣好的花蓮及台東一帶，經由指定的品種與飼養方式，再由指定飼養雞場，加以嚴格執行及把關，使北投齊雞的雞肉，其肉質與鮮嫩度，都與市售的雞，截然不同，這是北投齊雞的特色，更是北投齊雞成功的要素之一。
fc75be8b-647e-4d68-b65e-e8eb030be031,北投區,臺北市北投區北投區光明路78號,KAF COFFEE,專營精品莊園咖啡、手做甜點、咖啡器具
fcd2cfef-e435-4fda-a6c4-8acc42140d9d,北投區,臺北市北投區磺港路4號1-3樓,REEDS BOOKS 北投店,每日提供新鮮餐點及現做麵包                       書店提供多樣高質感選品及書籍 明亮舒適空間及親切員工皆在店裡歡迎您 Serving FINEST & FRESHEST. High quality product selection. Welcome to Reeds Coffee & Book Store to enjoy your quality time!
fd0e9770-cc4c-41ab-8cf8-cc1e4b3a4f6c,北投區,臺北市北投區永明里石牌路２段９９巷１號,燦坤實業股份有限公司石牌數位分公司,燦坤3C為全台3C通路龍頭，全台共280家門市，並擁有完整的電腦通訊與家電商品佈局。燦坤3C以有溫度的服務力、專業諮詢與解決的技術力，及超越客戶期望的產品力，帶來友善全客層的3C通路體驗，並提供3C商品維修服務、延長保固、洗衣機與空調保潔等售後服務，實現3A4心「Anytime、Anyone、Awesome」，「用心的經營、安心的購物環境、貼心的服務、放心把需求交給燦坤」的服務精神。
fda9b290-0289-4cc2-a3a7-121d083f5d32,北投區,臺北市北投區泉源路12號2樓,石二鍋捷運新北投店,石二鍋!來點新鮮的! 經典平價台式個人石頭鍋搭配228元起多種主餐選擇，以平價享受新鮮食材、新鮮湯底⼝味與新鮮的服務體驗，在石二鍋讓品嚐新鮮成為⼀件簡單的事情。  王品集團寵愛會員無極限！加入王品瘋美食App，會員現領＄100吃飯金、獨享瘋點數最高8%回饋、瘋點數1點抵1元折抵無上限！旗下中餐、日式、韓食、異國、火鍋、燒肉及鐵板燒料理，全台300間餐廳任你挑選，吃什麼都有瘋好禮！手刀下載: https://wowfoods.cc/taipeipass 以上優惠條件及活動限制辦法，依品牌官方網站公告為主。
ffcddb8b-65a7-48f0-9433-be312f769163,北投區,臺北市北投區光明路１２０號,EASY SHOP 北投光明店,EASY SHOP台灣女性內衣通路第一品牌，融合實體門市及自營線上購物官網，創造出顧客隨時隨地購物的多元平台，提供優質商品及美好購物體驗
